datetime,source,url,title,content
2020-07-10,新闻一家人,http://mp.weixin.qq.com/s?__biz=MzA3MTA4MTAzMQ==&amp;mid=2657480670&amp;idx=1&amp;sn=0e3fed3854ca5ccec19e4c479ff56bcd&amp;chksm=84a242f6b3d5cbe03d4e4153b64932081a1b10bf186862afc3e0e6eebfc93a384ae2ae2b91e6&amp;scene=27#wechat_redirect,明新记忆 | 一院两平台，三人四春秋,"葛书润，2016级新闻学院新法实验班本科生；邓海滢，2016级新闻学院新法实验班本科生；林子璐，2016级新闻学院本科生。本科期间，三人均加入了《新闻周报》、RUC新闻坊两个院内学生实践平台；合作作品《马连洼西路大撤退》（截至删稿阅读量26万+），《胶水里游泳：外卖骑手的流动人生》（发于澎湃新闻镜相频道，并获当月排行榜第五名）；《高烧遇冷？城市马拉松的冰与火之歌》（获中国数据新闻大赛三等奖）；《“佼佼者”嘉洋》（获“澎湃·镜相”非虚构写作大赛提名奖，位列第十二名）等。她们的故事，从一篇报道开始。三人“在路上”，从左至右依次为：邓海滢，葛书润，林子璐冬天里的一把火虽然同在新周评论部当干事，但起初她们鲜有交集，直到2017年的初冬。那年冬天，北京开始了一场轰轰烈烈的清退群租房的行动。当时网上虽然有一些关于此事的消息，但相关报道却寥寥无几。真正促成她们要去实地看一看的契机是林子璐刷朋友圈时看到：西门外的烧烤摊摊主决定回老家，因为他们住的群租房被清退了。“我感觉没法就坐在宿舍里看着这一切发生”，被清退的房子到底有什么隐患，突发的行动给漂在北京的外乡人带来什么样的影响，这一切的答案只有到实地去看才有可能得到答案。借助微博聊天初步锁定了采访地点，林子璐和同部门的葛书润、邓海滢一起，在周末的清晨搭上了前往马连洼的公交。但采访并不如她们一开始所设想的那般顺利。邓海滢回忆道，原本微博线索中的地点在仁和公寓，但抵达后才发现，现场已经完成清退，人去楼空。在北京的大风天里晃悠了半天，也没能见半点人影。经过一位居民的指路，才找到了正在清退的几处居民点，采访有了柳暗花明的机会。十一月末的北京已经足够冷，要清退的群租房里断水断电，群租房的房东邀请她们进屋谈谈的那一刻，她们“感觉整个人都活过来了”。“挨了那场冻，我们似乎更能和当晚要离开的人共情。那天晚上，我们起码还能回到宿舍，但他们是真的没地方去了，” 葛书润说。马连洼现场，搬家公司搬运的基本都是大件财产，普通物品被丢弃到一边。没有多少时间的人们必须反复核算成本，做出最经济的抉择。回去的公交车上，三个人不约而同，“一定要在当天写完这篇稿子”。驱动她们的力量很简单，像林子璐所说，“当时有一种一定要去记录什么，表达什么的冲动。”当然，在三个大二学生有点热血上头的时候，学院的老师也适时给她们“降了降火”。葛书润提到，在写作稿件时，她们曾经考虑过要不要提及附近有人自杀的传闻写进去，但唐铮老师的三连问“能确认消息的真实性吗？和你们报道的主题有关联吗？报道出来是否会导致舆论失焦吗？”让她们重新审视了自己在写作时是否过度被情绪牵动，反而忽视了新闻真实和平衡的要求。“这样的状态其实蛮常见，但这是危险的。”在成稿后的反思里，她们时常感激这桶冷水。现在回想这篇稿子，葛书润觉得，尽管这篇报道在专业性和结构方面有颇多不尽人意之处，但是它“填补了一个可能被主流媒体遗漏的现场。”“如果说得再矫情一点，那就是当时燃起的新闻专业理想的火焰至今也没熄灭。”林子璐说。“永远不设限”被问及关于新闻实务的经验，林子璐说：“永远不要给自己设限。”她提到她在南方周末时的实习老师：她是一位资深记者，跑了自己的口子十多年，自己也成了该领域的半个专家。《马连洼西路大撤退》后，三人多次合作，先后尝试了深度报道、杂志制作、数据新闻和非虚构。正是在屡次尝试中，她们打破了自己给“新闻实务”设下的限制。新的选题，新的内容，倒逼着她们不断迭代自己的技能，尝试更新颖、更合适的呈现方法。大三上，她们一起选修了杂志编辑和数据新闻两门实务课程。封面报道的采写可以算是“老本行”，但杂志的设计、数据新闻的制作，却不断逼着她们跳出舒适圈，去做新的尝试。三人“杂志编辑”课程作品——《零点五倍速》封面邓海滢就是从她们的“数据新闻”课程作品《高烧遇冷？国内马拉松的冰与火之歌》开始，逼着自己成为一个“半吊子多面手”——哪怕用笨办法，也要死磕新技术。“做《马拉松》的时候就是把自己当假AI，硬生生人工清洗了三四千条数据，还兼职设计师，在不会编程的情况下通过仿写通宵速成了echarts（一个用Javascript的数据可视化工具）。”这几次试炼，也让她对那句“新闻的边界是液态的”有了切身的理解。“为了把事情清晰、深度地传达给公众，新传工作者应当拥抱新角色和新技能。”大三下，三人又做了一次“轨道”外的尝试：报名参加澎湃新闻组织的非虚构大赛。和传统的深度报道略有区别，这篇非虚构作品记录的是一个高功能自闭症患者的一段人生，如何写出“故事感”让人头秃。在截稿前的三天里，她们把原稿的整个框架推倒重建，只为了让叙事的节奏更明快，故事更流畅。最终，这篇非虚构的处女作《“佼佼者”嘉洋》在几千个作者中夺得第十二名。“这至少让我们见到了非虚构的大门长什么样。”林子璐说。三人参加澎湃新闻创作者大会这些尝试让她们的四年新闻专业学习更有实感，也慢慢领悟到，专业本身并没有划定的栅栏，只要自己去争取和体验，就能见到更壮阔的风景。她们最近参与了一篇关于新闻学子求职路的稿件创作，在行文最后，葛书润写道，“‘新闻学子不一定奔向新闻行业，而新闻行业的人也不一定来自于新闻学院’也许并非一种不健康的生态；新闻行业要求行业人才的多元化发展，除了吸引着其他专业的毕业生，也促使着新传学子培养自己的能力朝多元化发展。”好奇也是一种意义她们说自己“只能算半只脚踏入了新闻”，但她们也不是没为这踏出的半步思考过：我们所正在做的事情，真的有意义吗？2017年冬天的马连洼租户区，几个被清退的租户站在寒风里打量她们：“你们是不是记者啊？你们能不能帮我们反映一下？能跟上面说说吗？”那一刻林子璐意识到，她们能做到的和想做的依旧相隔遥遥。“想知道”没错，但这够吗？从新闻周报退休后，三个人没闲着，转移阵地，成为了院内另一个主打数据新闻和深度报道的学生公众号“RUC新闻坊”的小编，在方洁老师的指导下，和另外的小编们合作，操作着五花八门的选题。远至巴黎圣母院的大火、普利策的开奖、英国的冷柜货车案、鲍某某疑似性侵事件，近的也有周杰伦的新歌和李佳琦的直播间。一个个热点跟下来，有时熬夜通宵也不觉得累，只因为这是“自己想知道”。“想知道事情的前因后果，也想知道呈现这样的事件还有什么样的新可能。”邓海滢说。每次实践都能成为一场冒险。今年春节前夕，新冠疫情肆虐全国。RUC新闻坊的小编们和指导老师方洁都觉得在这么大的事儿面前，虽然是学生，但好歹是新闻学院的学生媒体，“总该为此做点什么”。但去往风暴中心武汉，对很多社会媒体来说都是一种奢望。想了解现场，想传递有效信息，为此，新闻坊想出了五花八门的迂回之策：从小编自己对家乡抗疫的书写，到向武汉当地的亲历者征稿、约稿，再到从报道和社交媒体中爬梳相关数据，再到为疫情梳理双线的舆情史……步步探索中，新闻坊的疫情报道系列阅读量刷新着自己的记录，从几千，逐步攀升到几万、十万加，再到被姚晨等大V转发，几乎谁都没料到这个“想知道”能自己走这么远。三个人都参与到了这场强度不低的创作中，时常为作出一张数据图、想出一段好结语心神不宁。但邓海滢说，当这些稿件被看见、被肯定、被讨论的时候，她会觉得自己做的事“好像有那么点意义”。不理解的声音仍然会有，但发现“不理解""也有意义。葛书润参与的新闻坊稿子《那些被吐槽的国家，为抗疫“默默”做了哪些努力？》发布后引起了不小的争议，有读者认为这篇文章开阔了视野、带来了理性，但也有不少的声音认为这是一种带有偏见的“辩护”和“支持”。被问及此事，葛书润说，最初大家想做这篇稿子，也不过是出于好奇：难道其他的国家真的那么“随意”吗？是否有一些经验在舆论场中被隐匿了呢？“我觉得‘想知道’和‘摆事实’都不会是错误。如果有人觉得这是一种辩护，恰巧从侧面说明了大家都意识到这场叙事背后的确存在某种失衡，而发现这种失衡是有意义的。”邓海滢葛书润林子璐为了这份“想知道”的热情和“摆事实”的能力，她们将继续在人大新闻学院就读。苟日新，日日新，又日新，新闻学是一门永在更新、在流动的学科，当被问及是否会在新闻这条路上走下去时，她们无一不立刻回复道：会！文字：新闻中心 李自然 图片：受访者提供美编：新闻中心"
2020-07-08,新闻一家人,http://mp.weixin.qq.com/s?__biz=MzA3MTA4MTAzMQ==&amp;mid=2657480637&amp;idx=1&amp;sn=69f94ea22f9c597a9762377edfb792e7&amp;chksm=84a24295b3d5cb83b0e3ad33d153476136a01c66d23cb85af144f7182053857583c9852b89e2&amp;scene=27#wechat_redirect,新闻学院主办五校联合第一届全国新闻传播学研究生“青梅论坛”,2020年7月4日，由中国人民大学新闻学院、安徽大学新闻传播学院、南京大学新闻传播学院、浙江大学传媒与国际文化学院、中山大学传播与设计学院联合发起的第一届全国新闻传播学研究生“青梅论坛”顺利举办。近1600名师生通过腾讯会议平台及其直播线上参与了此次论坛。论坛开幕，由轮值主办方中国人民大学新闻学院执行院长胡百精教授进行开幕致辞，胡百精教授寄语与会的同学们“在珍珠般的年纪，绽放珍珠般的光华”。胡百精教授表示“青梅论坛”是我们期待中的、理想的学术平台，“希望通过这一青年人的学术论坛，向青春致敬，向青春的学术致敬”。论坛旨在发现优秀的论文，发现优秀的年轻人，努力搭建形成“产销一体的学术展示会”。随后全体与会人员线上合影。中国人民大学新闻学院执行院长胡百精教授开幕式致辞第一届新闻传播学研究生“青梅论坛”与会人员合影论坛根据主题分为四场。第一场主题为“身份表达与群体认同”，由浙江大学传媒与国际文化学院院长韦路教授主持，中国人民大学新闻学院教授、《国际新闻界》主编刘海龙老师和中山大学传播与设计学院李艳红教授担任点评嘉宾。五位同学展示汇报后，李艳红教授分别从研究问题是否具有重要性与开放性、研究设计与理论框架、方法材料的收集与分析三个层次对前三篇论文提出了修改意见。刘海龙教授则针对后两位同学的论文提出，在对一般性研究问题进行探究时，还需要根据研究对象特征进行一些独特性探索。第一场“身份表达与群体认同”嘉宾与论文作者合影第二场主题为“媒介理论：探索与反思”，由中山大学传播与设计学院院长张志安教授主持，《新闻记者》主编刘鹏老师、安徽大学新闻传播学院副院长刘勇教授担任点评嘉宾。五位同学展示汇报后，刘勇教授进行了详尽的点评，并提出“理论研究进与出”的问题，他指出，“进”理论当深入理论的根源和脉络，做出深描，“出”理论则应当关照当下，也需要注重理论的适用性。刘鹏老师肯定了各位同学对于新闻传播学经典著作的阅读，并建议“避免做对策性研究，有损文章的学术品质”。第二场“媒介理论：探索与反思”嘉宾与论文作者合影第三场主题为“技术平台与社会景观”，由安徽大学新闻传播学院院长姜红教授主持，中国传媒大学新闻学院院长、《现代传播》主编隋岩教授和浙江大学传媒与国际文化学院刘于思副教授担任点评嘉宾。五位同学展示汇报后，隋岩教授围绕“现代性”从研究的方法、路径、对象选择提出了修改建议，并认为与自然科学中的“绝对真理”不同，社会科学中“真理是相对的”。刘于思副教授针对同学们的汇报提出研究中需要思考的三点共性问题：理论适用性、理论指向的范式与分析方法、分析单位的选择。第三场“技术平台与社会景观”嘉宾与论文作者合影第四场主题为“新闻场域:理论与实践”，由南京大学新闻传播学院执行院长张红军教授主持，复旦大学新闻学院教授、《新闻大学》常务副主编朱春阳老师和南京大学新闻传播学院卞冬磊副教授担任点评嘉宾。卞冬磊副教授给出修改意见后指出，同学们不应陷于平庸的规范，但仍处于学习规范的阶段，如何使用理论，在论文中安插理论资源，是一个长期的问题。朱春阳教授则引用“学而不思则罔，思而不学则殆”提醒同学们学会处理读书与思考之间关系，并提出要勇于提出自己的观点，“以我为中心”进行材料有机取舍，同时慎用概念，保持研究范式的一致性，不应在多种范式中游移。第四场“新闻场域:理论与实践”嘉宾与论文作者合影随后，由中国人民大学新闻学院党委书记周勇教授宣布本次论坛的论文推荐名单：最佳论文中国传媒大学传播研究院  张文娟《“底层”数字化生存的可能及其意义—-基于下岗工人生命历程的观察》优秀论文中国人民大学新闻学院  段世昌《从寄生到共生——平台与基础设施的关系研究》浙江大学传媒与国际文化学院  胡梦佳《为尼尔·波兹曼正名：兼论“媒介即隐喻”的理论内涵》复旦大学新闻学院  刘浏、陈泽月、郭文浩《变化中的“新闻场域”：基于自媒体“调查新闻”的分析》中国人民大学新闻学院党委书记周勇教授宣布本次论坛的论文推荐名单最后，第二届“青梅论坛”轮值主办方南京大学新闻传播学院执行院长张红军教授进行闭幕致辞。张红军教授首先鼓励各位青年学子在这思想解放理论创新的最佳时期继续努力，并向此次论坛点评的专家学者表示感谢，期待明年能够继续为青梅们指点迷津，最后邀请各位师友在明年青梅结子之时，具身地相约南京大学。南京大学新闻传播学院执行院长张红军教授闭幕式致辞据悉，论坛共收到海内外63所高校的有效投稿91份，经一轮初审和两轮终审，共有20篇稿件入围。论坛议程公布以来，共收到1467条旁听报名。下一届全国新闻传播学研究生“青梅论坛”将由南京大学新闻传播学院主办。文字&图片：中国人民大学新闻学院
2020-07-07,新闻一家人,http://mp.weixin.qq.com/s?__biz=MzA3MTA4MTAzMQ==&amp;mid=2657480638&amp;idx=1&amp;sn=82800d086da6ed42ab5c2ec49b7ff1ea&amp;chksm=84a24296b3d5cb805f029055a831a167d7ddde6f1954106cf4b581a708a4a6486f330c9f2320&amp;scene=27#wechat_redirect,明新记忆 | 2020中国人民大学新闻学院毕业视频,我还想去同样的地方拍一组的毕业照去食堂买一碗热乎乎的面条吃去明德楼刷一次夜再抢一次图书馆靠窗的位置和室友再跨一次年……疫情带来遗憾种种我们且见信如晤命中注定的别离预示着重逢就在前面视频：宣传部美编：新闻中心
