datetime,source,url,title,content
2019-09-11,新闻一家人,http://mp.weixin.qq.com/s?__biz=MzA3MTA4MTAzMQ==&amp;mid=2657479153&amp;idx=2&amp;sn=328740844ae755e7636f8a447829811d&amp;chksm=84a244d9b3d5cdcf243d927c626b2156446fbc3d0b135f49ab02eb5d2f5151b5fea1694ef9aa&amp;scene=27#wechat_redirect,通知｜人大这扇门即将限时开通,也许，你对人大校园的印象是威严的明德红砖，是清新的教二草场你在篮球场见到过少年们腾空而起你在田径场目睹过健儿们身姿飒爽你路过图书馆，不禁惊叹这真是一座宏伟的知识殿堂你踏遍校园各个角落的饭店和食堂心想，饭菜真香林荫路间的水雾让你心情舒畅也偶尔会喜欢上校园超市的人来人往夜晚的星空，自习室的灯光都是心里久久的愿望但这并非是人大校园的全部如若你穿过一扇神奇的门你便能看见，在这校园之中还有全然不一样的风光这扇门，叫做艺术（图：民乐团“丝路回响”——“一带一路”主题音乐会）这里有一望无际的黄沙大漠丝竹悠扬，锣鼓响亮古道之音，丝路回响（图：交响乐团“冬夜幻想”专场音乐会）这里有浪漫欢畅的西方奇境悠扬婉转，澎湃高昂声声醉人，冬夜幻想（图：合唱团“光影流声”专场音乐会）你也会进入儿时熟悉的影视世界天真童趣，奇思妙想光影流声，热泪盈眶（图：键盘乐团“锦瑟年华”专场音乐会）精巧别致的键盘乐为你再现温柔时光真情涌动，温暖心房锦瑟年华，缓缓流淌（图：话剧团“灿烂的日子”专场演出）走着走着你也会领略一番夕阳人生辗转，波折彷徨灿烂日子，生命之光（图：舞蹈团“选择”专场演出）你同样也会走到人生的十字路口挥汗如雨，前路迷惘从心选择，绚丽绽放（图：京剧社“武家坡”专场演出）此外你还能探寻一番国粹之声颦蹙之间，意蕴深长武家坡上，浓情难忘当然，还远远不止这些有聚光灯的地方就会有学生艺术团的身影（图：合唱团建军90周年）我们在人民大会堂感受人民的力量在更大的舞台回首祖国的华章（图：大学生艺术节）我们前往艺术赛场全力以赴，展现人大学子的形象（图：出访）我们在世界各地探寻在国际文化交流中，传递艺术，成就理想（图：艺先锋 艺实践）我们将艺术带向基层在人民群众中学习经典，努力发扬如果你也想亲自领略这番风景那么，学生艺术团的门，已向你敞开欢迎你加入中国人民大学学生艺术团中国人民大学学生艺术团成立于1990年，是一支由学校创建的学生业余文艺团体，是广大爱好艺术的人大学子进行艺术实践与的园地，是学校实施艺术教育和美育教育的第二课堂，是人民大学的一支文艺代表团体。学生艺术团由校团委直接领导，下设民族乐团、交响乐团、合唱团、舞蹈团、键盘乐团、话剧团、京剧社共7个分团及综合事务中心6个职能部门，成员由来自学校24个学院的非艺术类专业本科生和研究生近400名同学组成，并聘请业界知名人士担任艺术指导教师。我们诚挚地邀请你来到学生艺术团这个温暖的大家庭报名方式关注公众号“RUC学生艺术团”，近期会推出各分团详细介绍，届时在推送中均可报名。如果你已经迫不及待想要加入艺术团的大家庭，也可以直接点击“阅读原文”填写报名表哦～文案｜学生艺术团宣传部编辑｜张朋燕责任编辑｜修瑞临RUC学生艺术团Art is everywhere.微信公众号：rucartist点击“阅读原文”，填写报名表
2019-09-10,新闻一家人,http://mp.weixin.qq.com/s?__biz=MzA3MTA4MTAzMQ==&amp;mid=2657479143&amp;idx=1&amp;sn=5dca8666064433a43f9dbf2fce1cbe30&amp;chksm=84a244cfb3d5cdd929a0d5711e813add8f6c21d57e60061834afc0885fd8fb9595aa0b94470b&amp;scene=27#wechat_redirect,院会纳新 | 新闻学院学生会纳新大会——等一场美丽的相遇,如果你想结交好友想提升自我如果你愿意服务他人那么快加入我们新闻学院学生会新里有你盼你前来等一场最美的相遇报名方式参加招新大会报名者参加9月11日（本周三）晚7点，在明德新闻楼0208举办的中国人民大学新闻学院学生会纳新大会，现场扫码填写线上报名表报名。明招新大会现场，师兄师姐会有神秘礼品相送哦~网上报名9月11日晚招新大会结束之后，报名者可在“新闻一家人”公众号当日推送文章底部点击“阅读原文”填写线上报名表报名。逾期或其他不符合本公告规定的报名无效。学生会简介中国人民大学新闻学院学生会是一个团结新闻学子、服务广大师生的学生组织，在发展的过程中不断凝聚和培养一批批德才兼备、有志奉献的青年人才。众所周知，人才是一个组织生存和发展的基石，正是这些青年才俊的无私奉献与艰苦奋斗，促使新闻学院学生会发展成为一个拥有高团队凝聚力与综合实力的学生组织，使“新闻一家人，我们爱你们”的口号越喊越响亮。目前，新闻学院学生会由办公室、生活部、志愿团、宣传部、外联部、体育部、文化部、新媒体中心、新闻中心、学术部、组织部、实践部等十二个部门组成。各部门通力合作，为服务新闻学院师生，丰富校园生活而共同努力。新闻学院艺术团简介从寒冬夜里的129到五月艳阳下的艺术节，新闻学院艺术团用汗水来填满，为新闻学子带来丰富的文化生活。体育社团简介新闻学院体育社团由男篮社、女篮社、足球社、男排、女排组成，各个体育社团的同学们积极训练、比赛，在各种大小比赛中取得亮眼的成绩。9月11日（本周三）19点中国人民大学新闻学院学生会纳新大会明德新闻楼0208我们不见不散新闻学院学生会
2019-09-10,新闻一家人,http://mp.weixin.qq.com/s?__biz=MzA3MTA4MTAzMQ==&amp;mid=2657479143&amp;idx=2&amp;sn=0a2816fb1d9d465ec9a00d8bc1cea412&amp;chksm=84a244cfb3d5cdd915141b9bad447a9bef918864e561701b5ff31e719e7fc27d2fa1978555f9&amp;scene=27#wechat_redirect,预热 | 新生篮球赛：是开始，是出发,邀请函亲爱的19级萌新们：也许你有一颗在球场上挥洒汗水的心，也许你想要观看一场精彩绝伦的比赛。无论你是哪一种，都希望能用一场精彩的篮球赛开启你多彩的大学生涯！9月12日（本周四）18:00，品园篮球场，我们不见不散。 ---新生篮球赛欢迎扫码进群，了解更多相关消息~9月12日星期四18:00品园篮球场，精彩等你来！文字：体育部美编：新媒体中心
2019-09-08,新闻一家人,http://mp.weixin.qq.com/s?__biz=MzA3MTA4MTAzMQ==&amp;mid=2657479134&amp;idx=1&amp;sn=7dbd811b1c358753eef375e5dd1bac32&amp;chksm=84a244f6b3d5cde05335e474375ba1d6cea57d1e6a5052a0385a4c4364dea4ac39e48c292c21&amp;scene=27#wechat_redirect,新闻学院2019年开学季系列活动安排,各位2019级新生：欢迎加入中国人民大学新闻学院的大家庭，小编为大家整理了开学之后的各项活动安排，具体如下：1新生报到时间：9.9（周一）7:30-18:00地点：明德广场东侧参与人员：全体新生2学院新生家长工作坊时间：9.9（周一）15:30-16:30地点：明德新闻楼208教室欢迎所有新生家长！3“一带一路”全英文硕士项目迎新时间：9.9（周一）16:00-17:00地点：请等候具体通知。参与人员：“一带一路”全英文硕士项目新生4宿舍看望新生时间：9.9（周一）17:00地点：新生宿舍内参与人员：学院老师会进入宿舍探望新同学。5新生班会时间：9.9（周一）18:00地点：请参阅迎新现场下发的《2019迎新工作安排》，对照所在班级前往班会地点。参与人员：全体新生6图书馆使用培训时间：9月10日（周二）9:00-10:00地点：公共教学一楼1305教室参与人员：全体本科新生7研究生开学典礼&入学教育和指导时间：9月10日（周二）10:00-12:00地点：明德新闻楼3层演播厅参与人员：全体研究生新生8高校健康讲座时间：9月10日（周二）14:30-17:00，13:40前集合完毕，14:00前入座完毕。地点：世纪馆，集合地点在世纪馆南门院旗下。参与人员：全体本科新生必须参加，研究生新生自愿参加。注意事项：请参加的同学着院衫，并提前登录微人大学务中心平台完成报名。9本科生英语分级考试时间：9.10（周二）18:15-20:30地点：考试地点请等候教务处和外国语学院通知。参与人员：全体本科新生10实验班面试选拔时间：9.11（周三）9:00-12:00地点：      创意传播实验班——明德新闻楼508会议室      新闻学-法学实验班——明德新闻楼611会议室      国际新闻全英文实验班——明德新闻楼711会议室      未来传播学堂——明德新闻楼601参与人员：提交对应申请表的本科新生11开学典礼&交通安全讲座时间：9月11日（周三）14:30-17:00，13:40前集合完毕，14:00前入座完毕。地点：世纪馆，集合地点在世纪馆南门院旗下。参与人员：全体本科新生及部分研究生新生必须参加，家长自愿参加。注意事项：请参加的同学着院衫，并提前登录微人大学务中心平台完成报名。12实验班选拔口语考试时间：9月11日（周三）18:00-20:00地点：详见教务处和外国语学院通知。参与人员：部分本科新生13本科生体检时间：9月12日（周四）8:30-9:30地点：校医院体检中心（四层）参与人员：全体本科新生（不包括留学生）注意事项：准备好170元现金用于支付体检费用，体检当日需空腹，穿纯棉类上衣，不佩戴金属饰物，并携带本人一卡通及身份证。14新生通过网上选课平台选课时间：9月12日（周四）12:30开始注意事项：详见教务处通知15研究生入学英语分班考试时间：9月9日至9月12日参与人员：研究生新生注意事项：具体流程请参阅迎新现场下发的《2019迎新工作安排》。16主题班会时间：9月14日（周六）或9月15日（周日）参与人员：全体新生注意事项：请新生班级自行安排具体的时间、地点，并在9月13日中午12:00前报备给明德新闻楼501办公室。17新闻学院大类培养方案解读时间：9月16日（周一）9:30-11:30地点：求是楼0220教室参与人员：全体本科新生18新生大学学习生活导航报到时间：9月16日（周一）14:00-17:30，13:10前集合完毕，13:30前入座完毕。地点：世纪馆，集合地点在世纪馆南门院旗下。参与人员：全体本科新生必须参加，研究生新生自愿参加。注意事项：请参加的同学着院衫，并提前登录微人大学务中心平台完成报名。19本科生开学典礼时间：9月18日（周三）下午地点：明德新闻楼3层演播厅参与人员：全体本科新生必须参加，研究生新生自愿参加。20研究生体检时间：9月23日（周一）7:30-10:00地点：校医院体检中心（四层）参与人员：全体研究生新生（不包括留学生）注意事项：准备好170元现金用于支付体检费，体检当日需空腹，穿纯棉类上衣，不佩戴金属饰物，并携带本人一卡通及身份证。如自愿接种疫苗，需多带101元现金。21教育类讲座与参观时间：9月9日至10月15日参与人员：全体本科新生注意事项：具体时间、地点请等待学院进一步通知22其他注意事项1. 绿色通道相关事宜：（1）已在“微人大”提交“绿色通道”申请——持相关证明材料，到“绿色通道”迎新现场（北区学生事务楼615）办理相关手续。（2）未在“微人大”提交“绿色通道”申请——持相关证明材料，咨询迎新点党委老师，出具相关证明材料，经学院初审符合标准，填写《家庭经济困难新生“绿色通道”申请表》，到“绿色通道”迎新现场（北区学生事务楼615）办理后续手续。                        （3）新生入学“绿色通道”服务时间为9月9日7:00-18:00，办理宿舍入住后可前往办理相关手续。2. 港澳台学生到所在宿舍楼办理入住后，持证件返回迎新现场“港澳台办公室”迎新服务台领取相关材料。3. 未缴费新生请于9月9日6:30-18:00到科研楼B座一层财务处大厅交费。各项活动如有调整，将另行通知，请大家在参照本篇推送的同时，以具体通知为准。祝各位新生在新闻学院大家庭中遇见更好的自己。新闻学院
2019-09-08,新闻一家人,http://mp.weixin.qq.com/s?__biz=MzA3MTA4MTAzMQ==&amp;mid=2657479134&amp;idx=2&amp;sn=0a86392dcb86f87d795d5778800ab6ca&amp;chksm=84a244f6b3d5cde06b5f1c79077548bfe059d02c4510e32a0ce8cea02440989ff570562cc964&amp;scene=27#wechat_redirect,官宣！人大学子与社会实践不得不说的故事,
2019-09-07,新闻一家人,http://mp.weixin.qq.com/s?__biz=MzA3MTA4MTAzMQ==&amp;mid=2657479128&amp;idx=1&amp;sn=819760cb733e03204f049576e5ce0860&amp;chksm=84a244f0b3d5cde6b3a21bd56a0b85a3e1c7f01bdd128be0d23c5821b820b53b2b77c630ed37&amp;scene=27#wechat_redirect,迎新特辑 | 新学期还是先听我的,面对19级新生的到来，在中关村59号混成半土著的师兄师姐们有些肺腑之言要交代。下面这点干货请务必就鸡汤内服（抱拳）。新学期 听我的放下手机拿起书1@guarantee有空的时候少玩手机多看书，专业书非专业书都可以，《新闻的骚动》、《乌合之众》、《娱乐至死》、《童年的消逝》等等，既然在新闻学院学习就注定了你需要多领域的知识积累。  @嗡看什么书都行，只要你在看书而不是玩手机就好；摄影笔记公众号不错，摄影的基础知识上面讲得挺清楚的，其他报刊的公众号多多少少关注一点（人民日报、新京报、冰点周刊等等）。@ginger soda开学后各门课的老师应该都会推荐比较多的书籍给大家，务必记得记住，不要被数量劝退，挑几本感兴趣的慢慢啃吧。心情烦躁或者无所事事的时候除了沉迷手机，还可以去图书馆逛逛，在书架之间穿梭，看着大家认真学习工作的样子，心或许会静下来。@小布丁英语四六级真的需要备考。上了大学之后，英语学习强度大大下降，不夸张地说，应对平常考试，只要背完单词，高中的水平完全没有问题。但是四六级考试和高中英语在难度上真的还有挺大差别的，尤其是听力，考试时所有内容都只念一遍。对于英语水平一般的小伙伴，大学仍然需要多花一点时间提高自己的英语水平。摆正心态向前冲2@嗡提高对自己的要求，不满足于达到某一个标准，在自己力所能及的范围之内做到最专业。@guarantee你可能发现大学也并没有轻松到哪里去，迷茫、沮丧、焦虑这些可能也都会有，但是不要着急，做一个大致的长远规划，然后把眼下的事情尽力去做好，想尝试的就去尝试，不要背负太多心理压力。要清楚自己的目标和能力，和高中一样尽自己最大的努力去把事情做好；感兴趣的东西都可以去学，喜欢摄影就多看摄影教程多去拍照学习用PS修图，喜欢写作就开公众号去写，能做和想做的事情应该即刻启程。@硫酸铜你会在这里遇见很多厉害的大佬，心态别浮躁，还是要多多向身边的人虚心学习。美食地图任开拓3坐拥黄金地段和优质校内平价美食天堂，这里是你吃遍北京的出发点。@少典（隐藏版知行CBD）校内早餐推荐有知行楼下的早餐摊（胡萝卜粉丝包很好吃），以及汇贤饺子旁边那家店铺的早点。他们家的八宝粥简直绝了！！还推荐知行一楼对面的妈妈手快餐，以及汇贤超市到静园水果店那条路上的老麻抄手。@bjyxszd东区二楼特别多好吃的！！！北区有..难吃。知行CBD没了之后卖烤冷面狼牙土豆和豆腐的摊位建了个美食群，可以点了送到楼下，吃夜宵很方便。@嗡食堂吃腻了吃餐厅，餐厅吃腻了点外卖，外卖吃腻了去食堂，关注温馨人大公众号，勇于尝试不同食堂的菜，说不定你心仪的菜就在那里等待着你；推河间火烧店的抄手和中区二楼黄焖鸡；南区的水果店有切成盒装好的水果，品种比静园水果店丰富，如果你懒惰的话，可以去那里买水果。@硫酸铜便利蜂不错，可以解决一日三餐，而且24小时营业；推留二的千荷煎饼，赶课来不及吃饭的时候的好选择。@guarantee中区二楼的黄焖鸡挺好的，辣度慎选，本湖南人中辣已经是极限，二楼各种面基本上都不错，印象中没有踩过雷；知行的朋友如果实在懒得跑远只想在北区食堂吃的话，个人觉得北区二楼比一楼好很多。少宅寝室多活动4@小布丁建议在大一上学期，学业还不紧张的时候，多花一点时间去做志愿，因为学校是有40个小时志愿时数的要求的。除此之外，还有形式与政策的讲座，两年要求有60个积分，也就是要听12场，建议如果能抢到名额，就多多去听，因为大一下你可能都在一场不落地抢读史读经典的讲座~@L在出行方面，学校附近有两个地铁站，靠近东门的是人民大学站，靠近西门的是苏州街站。但是，对于住在知行楼群的小伙伴来说，无论哪一个，距离都有些远，而且知行楼群附近缺少可以代步的共享单车。因此，这里推荐另外一条线路，可以从小北门出去走到海淀黄庄站，四号线和十号线都从这个站点经过，重点是，路上经过的人大附门口有许多共享单车。宝藏四号线  支持你从头玩到尾@嗡可以买一辆自行车，你会觉得生活充满了幸福。故宫、国家博物馆、世园会、法源寺、动物园、植物园、东交民巷、颐和园、圆明园、隔壁知名高校都等着你打卡。 @硫酸铜人大地段不错，三个门都靠近地铁，趁着住在城里的机会多出去走走，感受这座古都几千年的文化；故宫值得多去几次，恭王府和故宫的管理和环境都不错，其他北京名胜可以慢慢打卡；还可以去新中关吃喝玩乐，或者去798看展。@guarantee珍惜人大的地理位置，毕竟，你们毕业之后可能就再也住不上北京三环的房子了……@果冻北京的文化底蕴自然是很深厚的，自然风光也不错。各大有名的景点，建议挑课少的工作日去，这样人相对会少一点，比如每周的星期三下午，如果没有讲座或者志愿活动需要参加，可以外出尽情地玩耍。还有玉渊潭公园的樱花，香山的红叶，都值得一看。除此之外，北京还有很多相对小众的博物馆和美术馆，有些建筑和展品都很有特色，对这一方面感兴趣的小伙伴可以去看看。对我来说，学校周边最常去的地方，应该就是食宝街了，对于喜欢美食的小伙伴，不失为一个打牙祭的好地方。defend my 发际线5@果冻上大学后，时间规划全都靠自己，不像高中时作息规律，在大学熬夜是常事。但是，熬夜对于整个人精神状态的影响真的很大，而且熬夜的习惯一旦形成，随之而来的很有可能就是失眠。所以，老学姐给所有学弟学妹们一句忠告，安排好时间，尽量少熬夜，珍惜现在的发量和发际线。@嗡开学不努力，期末徒伤悲；期末复习尽早开始；上课认真记笔记，每节课后及时复习，至少要记得这节课大概讲了些什么；干什么事情都尽量往前赶，不要压DDL；晚上尽量十二点之前睡，早睡早起有利于减少脱发。@bjyxszd没有人监督就会放松了，到时候考试周压力就会很大。所以平时也还是要做好预习和复习，平时分也很重要。开学必备来一波6@硫酸铜丢眼镜了的话可以去知行地下眼镜店配，马上就能拿，不会耽误上课，价格不高，老板很可爱，如果你在那儿配的眼镜丢了再次去配老板会给打八折作为安慰。@少典如果有需要维修的东西，可以去汇贤超市附近的修理店或者知行地下看看。知行地下还会有洗衣店和理发店，可以去试试。@L必备的设备，就是电脑了。推荐还没有购买电脑的同学挑选诸如游戏本等性能好一些的电脑，因为之后需要剪辑视频时，电脑的性能直接影响你的工作效率。@嗡专业相关的一些设备比如相机、三脚架等，要注意量力而行，觉得对摄影没什么兴趣也不打算学广电的同学可以什么都不买。如果你足够有钱的话，甚至还可以买台无人机，如果你买到了，记得借给学姐我玩一玩。@小布丁宿舍的面积是真的不大，尤其是当大家的东西越来越多时，保持内务的整洁也变得越来越难。在开学还没有放行李时，建议就和舍友商量好桌子、衣柜、架子的布局，以及对于女生来说，以后有很大可能会需要的鞋柜和挂冬天厚衣服的立式衣架。建议所有的桌子都靠墙摆放，因为这样可以在桌子上安放比较大型的置物架或是收纳箱。开启新的征程也许会面临诸多困难，但别忘了新闻学院这个大家庭是你坚实的后盾。新同学们有什么困惑，不要怯于提问，相信师兄师姐、各位老师也不会吝啬伸出自己的援助之手。有什么问题和补充还请在下面留言哦~文字：魏诗雨 林珂莹 王婧雯 陆佳楠图片来自网络美编：陆佳楠
2019-09-02,新闻一家人,http://mp.weixin.qq.com/s?__biz=MzA3MTA4MTAzMQ==&amp;mid=2657479126&amp;idx=1&amp;sn=6cf256835609f2854cafc7b7be7bd947&amp;chksm=84a244feb3d5cde8434a2812d98b58eb990602509b0fcd7aa1a56717ee4b2285462ba0150429&amp;scene=27#wechat_redirect,迎新特辑 | 进入RUC，你准备好了吗,转眼间，暑假已经接近尾声了。作为准RUCer的你们，是否已经收拾好行囊准备出发了呢？不妨对着下面这份清单，看看还有没有什么遗漏吧！一、家中必带录取通知书、身份证、学生档案、团员证/党员证及组织关系证明、户口本复印件、银行卡、现金、证件照、秋冬衣物、手机、充电器、户口迁移证（需要迁户口的同学带）。二、从家带or到校买笔记本电脑、拖鞋、水杯、牙刷、牙膏、洗发水、沐浴露、护发素、毛巾、日用护肤品、本子、笔、移动电源、U盘、插线板、抹布、枕套、床单、被罩、被褥。三、到校再买桶、盆、洗衣液、衣架、被褥、收纳盒、垃圾桶、垃圾袋、床垫。日常生活用品等在报道当天的宿舍楼旁会设置摊点售卖，如果有其他需要的物品还可以去学校西门外的城乡仓储大超市采购哦。大学是你们人生中一个新的篇章。你们会在这里认识来自天南地北性格各异各有所长的同学，学习或是稍有了解或是完全陌生的各个领域的知识，面对无边无际没有拘束的广阔天地。你们会在这里自在驰骋肆意欢笑，也可能经历沮丧和迷茫。但无论如何，我们期待你们在这里留下独属于你们的印记。未来的画卷正在你们面前徐徐展开，新闻学院愿意一路相伴，守候你们成长为国民表率、社会栋梁。文字：王靖雯 林珂莹美编：林珂莹
2019-09-01,新闻一家人,http://mp.weixin.qq.com/s?__biz=MzA3MTA4MTAzMQ==&amp;mid=2657479115&amp;idx=1&amp;sn=cc40a47557f7a72ba6fe8af52ac9fe33&amp;chksm=84a244e3b3d5cdf58d7ef2e83478ecf8e232f4fb96d1cd96338cf69e9c5fa4b8524181a6be93&amp;scene=27#wechat_redirect,人大新闻学院师生走进新华社柏林分社,当地时间8月29日，人大新闻学院调研团师生到访新华社柏林分社，与分社社长严锋和三名记者就国际传播与新闻人才培养等话题进行了交流。 调研团师生与新华社柏林分社社长与记者交流严锋社长在会上介绍了分社基本情况、自己从事国际新闻报道的经历以及对加强国际传播能力的思考。他表示，新华社近年来非常重视推动媒介融合发展，通过积极探索，站在了国际媒体创新的前沿。 交流中，他鼓励同学们在校期间要培养扎实的语言功底、采集事实的能力、逻辑思维能力，要锻炼出健康的体魄，为日后从事新闻事业打好基础。 中国人民大学新闻学院调研团此行是赴德开启马克思主义新闻观溯源之旅，同时进行学院每年暑期开展的“一带一路”沿线调研。调研团与分社记者就中德文化教育交流合作及中欧班列等设施联通情况作了探讨。文字：葛书润 安若辰 吕轩昂图片：李宇轩美编：李宇轩
