datetime,source,url,title,content
2018-06-18,新闻一家人,http://mp.weixin.qq.com/s?__biz=MzA3MTA4MTAzMQ==&amp;mid=2657477704&amp;idx=2&amp;sn=5951d925e929d88bb8b0c626ebd917f4&amp;chksm=84a24960b3d5c076e04c39246f1e67c07e3edb14db09912d6d4b4ce4a605eb3d28025acd88fc&amp;scene=27#wechat_redirect,毕业季 | 毕业班风采展示——2016级硕士广电传经班,"相逢又告别,归帆又离岸，毕业是一次分别，也是未来旅途的开始。在接下来的一系列推送中，让我们一起听听毕业班的老师同学们的感想吧~班级风采简介2016级硕士广电传经班是一个团结友爱、奋发向上、朝气蓬勃的班集体，在班主任许向东老师的带领下，2年时间里，班级内部形成了强大的凝聚力，思想和学风建设取得了卓越的成效，开展了丰富多彩的班级特色活动。同时，班级同学每一个个体都在发挥自己独特的能量，在学习学术、社会实践等各自擅长的领域都取得了非常好的成绩。班主任寄语16金秋到18盛夏，我有幸担任了新闻学院2016级广播电视与传媒经济硕士班的班主任。两年时间里，我尽自己的努力去帮助大家，看到每位同学的成长与进步，着实感到欣慰。求职季亲眼见证了大家收获辛勤耕耘后的美好，更是从心底里为同学们开心。衷心祝愿大家都能在未来有光明的前景，实现自己的人生价值；也希望大家不忘母校与学院，常回家看看。——2016级广播电视与传媒经济硕士班班主任 许向东老师毕业感言两年太短，仅七百多个晨光熹微到日暮四合，银杏微黄时我们步入校门，学着做一名“实事求是”的人大新闻人，而今玉兰香犹存，前路漫漫未可知，不变的是以笔为剑的少年志气和人大风骨。此去经年，再会江海。感谢人大，感谢新闻学院，再见了，我们的“人民大学站”。——2016级广播电视与传媒经济硕士班李泽尔在人大新闻学院的日子只有短短两年，但中国人民大学三人行校徽和中国人民大学新闻学院的title带给我的却是一辈子的光环，这叫充电两学年，通话一辈子？在人大，我最感念的是结识了许多好朋友，我想以后关于人大的回忆，很大一部分是由与这些好朋友的点滴往事编织而成的。毕业要有仪式感，那我也跟自己说几句吧，希望以后自己再看到这些话能问心无愧:坚持实事求是的态度做人做事，天下大事必做于细，不断提高自己解决复杂事务的能力。人大，再见啦，我还会回来哒。——2016级广播电视与传媒经济硕士班龙锋""我们今天是桃李芬芳，明天是社会的栋梁。""无论是继续深造，还是走上工作岗位，祝福同学们都能完成自己的梦想。图文来自2016级广播电视与传媒经济硕士班美编：新媒体中心 陈昱希"
2018-06-17,新闻一家人,http://mp.weixin.qq.com/s?__biz=MzA3MTA4MTAzMQ==&amp;mid=2657477694&amp;idx=1&amp;sn=4e9bffbc3780c956199ff609d1e58d7e&amp;chksm=84a24916b3d5c00061fd7a74bc1bddbcbe747983256b6d74481021a9efc993f2d0c387a04b84&amp;scene=27#wechat_redirect,毕业季 | 毕业班风采展示——2016级硕士国新班,"相逢又告别,归帆又离岸，毕业是一次分别，也是未来旅途的开始。在接下来的一系列推送中，让我们一起听听毕业班的老师同学们的感想吧~班级风采简介2016级国际新闻传播硕士班为中宣部和教育部支持与协调下的“国际新闻传播硕士项目”在中国人民大学新闻学院的第九届项目，由29名本科来自新闻传播、外语和法律等专业的“国小新”组成。国新项目旨在培养一批具有“国际视野，家国情怀”的国际新闻传播专业人才，采用学界导师与业界导师“双导师制”的培养模式，既提供了学习新闻传播理论的广阔平台，又保证了锻炼国际新闻实务能力的实践机会。两年的学习中，除了新闻传播学科基础课和英语新闻实务课外，还包括重大会议与外事活动现场观摩、暑期赴外地社会实践、央媒国内外实习等丰富多彩的实践活动。班主任寄语2016级国新班，是非常富有朝气、富有凝聚力的班集体。能够和诸位同学在人大校园里相遇、相识、相知，是我的莫大荣幸。时光匆匆，离别在即，衷心希望每一位同学都能保有自己的淳朴初心，在未来的生活道路上快乐前行，并始终勇敢地成为你自己。——2016级国际新闻传播硕士班班主任 王亦高毕业感言还记得拉着行李箱在明德广场报到的样子，被要求去世纪馆照相，咔嚓，黑黑瘦瘦的样子留在了本科一卡通上。不知不觉已经成了老人大人，学校的变化很多。网线退出历史舞台，宿舍装上了空调，中区西饼屋变成了Bread and Cup，东西南北中每个食堂都改建了好多遍，健身房里的人越来越多……但，还是有很多没变的。汇贤饺子依旧天天排长队，知行CBD总是生意兴隆。我们总是执着地在西门前甩头发，在求是刷夜，在教二草坪晒太阳看星空……虽然平时免不了吐槽，但细细想来很感念在人大的每一天，每一位老师和同学。马上要各奔东西了，山高水长，愿各自珍重，一路顺遂！——2016级国际新闻传播硕士班胡文嘉仿佛昨天才第一次迈进人大西门，转眼已至离别之际。很幸运在人大度过了紧张而充实的研究生时光，更幸运能领略一众名师的学识与涵养，最幸运不过遇见16级的国小新们！我们有钟老师、高哥这样的“大家长”，我们一同在征妈的采写课上“备受煎熬”，我们用外语采访各国记者，我们还在湖南的烈日下拔草献花……不觉间“国新班”已成为我们每一个人的标签与烙印，59号院的明新楼早已是我们共同的家。人大给予我的尽是美好，我定永葆赤诚，不负母校。——2016级国际新闻传播硕士班李昊伟“How time flies!”真是句应景的话，2015年7月4日举行的2016级国际新闻传播硕士推免生选拔工作坊还历历在目，如今我在中国人民大学新闻学院的学习即将划上完美的句号。短短两年的时光，因“精而实”的课程、业界讲座，以及媒体参访、暑期赴湖南社会实践、央媒实习等活动显得越发“干货满满”，其间学到的知识将使我受益终身。愿在接下来的博士四年中，不忘初心，砥砺前行。——2016级国际新闻传播硕士班王睿路""我们今天是桃李芬芳，明天是社会的栋梁。""无论是继续深造，还是走上工作岗位，祝福同学们都能完成自己的梦想。图文来自2016级国际新闻传播硕士班美编：新媒体中心 陈昱希"
2018-06-17,新闻一家人,http://mp.weixin.qq.com/s?__biz=MzA3MTA4MTAzMQ==&amp;mid=2657477694&amp;idx=2&amp;sn=4fd875104e73dd497a14e40ab32cf5bd&amp;chksm=84a24916b3d5c0005d17d1a7bba695ec1344b41f36c3047c9f64818be4d185dc1d68dfd597c9&amp;scene=27#wechat_redirect,毕业季 | 你的行李包整理好了吗？,毕业季，与人大的角落道别的同时也是要与宿舍道别的时刻。四年堆积下来的不仅仅是宝贵的回忆，也有一大批行李正在等着你收拾。为行李苦恼的你，确认过眼神，本期正是你所需的推送！衣服收纳01 衣服用卷的比用折的快之外，还可以省下更多的空间，可以防皱，减少折纹。02 把衣服跟袜子叠在一起的话，也可以像下面这样把袜子当一个小型的收纳袋，物尽其用！（记得要用干净的袜子哦！）层叠放置层叠放置主要用在叠内衣、帽子等不平整的物件，把它们一层层叠起来可以节省更多的空间，突出部分可以塞进内裤、袜子等，并且还能够保护它们不易变形。01 把两件内衣叠在一起，然后用内衣带子扣在罩杯里面。02 把衣物叠好塞在帽子里，不仅能省空间，还能让帽子不被压扁。鞋子收纳01 把鞋子首尾交错放可以节省空间，另外还可以充当一些零散小物件（比如小药盒、充电器）的收纳容器，既能提升空间利用，又不怕小东西遗失在茫茫箱子里难以找到，还能保持鞋子形状。02 用酒店的浴帽或洗衣袋把鞋子套起来，这样既不会像专门的鞋袋一般占地儿，又不会弄脏行李箱。利用口香糖盒子放首饰空的口香糖盒不要丢，用来放发夹等小物件，方便又好找。易碎品处理01 衣服用卷的比用折的快之外，还可以省下更多的空间，可以防皱，减少折纹。02 稍厚一点的衣物可充当电脑、ipad防震包防污妙招01 在容易漏的化妆品、护肤品瓶口事先套一层保鲜膜，这样可以防止它泄露，尤其是精油、卸妆液什么的，一漏就弄得化妆包哪都是，这样先套一层膜就不会漏了02 像化妆要用到的各种刷子，也常会把化妆包弄脏，学会下面这招，眉笔、腮红刷、唇刷都能放到塑料手套里，轻松防污，精简出行化妆包so easy！电子产品收纳眼镜盒收纳电源线，不用的眼镜盒可以放充电线和耳机，方便好找也不会让行李看起来乱糟糟的。 利用口香糖盒子放首饰旅途上一物多用的小巧思必不可少。比如说，一个小药盒，既可以存放出行必备药丸，又可以按时间顺序放置事先搭配好的小首饰。除了本文中提到的这些方法，又有哪些小技巧是你的PICKS？来跟大家分享一下吧！毕业快乐图文：生活部 吕耀美编：新媒体中心 赵珉庆
2018-06-17,新闻一家人,http://mp.weixin.qq.com/s?__biz=MzA3MTA4MTAzMQ==&amp;mid=2657477694&amp;idx=3&amp;sn=c4c122d2634f079a832f27d40a0f6523&amp;chksm=84a24916b3d5c000a782ed781efdcb41b2f3b50d03aabca7005a4f9f3898981ea252553c298d&amp;scene=27#wechat_redirect,六月毕业季 | RUC2018届毕业生离校工作安排早知道&gt;&gt;&gt;,
2018-06-16,新闻一家人,http://mp.weixin.qq.com/s?__biz=MzA3MTA4MTAzMQ==&amp;mid=2657477687&amp;idx=1&amp;sn=fd78619310b2f418086e876b1e43b70d&amp;chksm=84a2491fb3d5c009d35fbb6d8139593da3f059a54e641d0d76ad43d4c4b27eb98efbfe6e9114&amp;scene=27#wechat_redirect,毕业季 | 我会很想念你·和你走过的每一个角落,和你走过的每一个角落我们身边总有无数个角落，仿佛他们的存在是理所当然的。四年过去了，与原本熟悉的校园告一段落。你们会想念这些角落吗？我会很想念你·快递点“ 四年里，我习惯了站在长龙中等候，在漫长的等待后接过各式各样的包裹，那是甜蜜而略微沉重的期待。虽然从此之后，我再不能在“地址”一栏端正写下“中国人民大学”，但我会把回忆往事时微涩的思念，托春风夏雨秋霜冬雪寄回给你，等待签收。”我也会很想念你·一勺池小径“ 我喜欢路过这里，四年如一日。如今将别，我深知还会有无数如我一般的人，在与过往四年如出一辙的夕阳下，踩着明暗交叠的光影从这里走过，渐渐淹没在熙攘人群里。是的，我也会想念你，很想念你。”我也会很想念你·人文楼9层阳台“ 这恐怕是人大校园内新闻学院专属的地方，夏日有霞的晚上，总能在这偶遇一些同拍的人。巧的话也能在朋友圈评论区知道他们的名字呢。”我也会很想念你·教二长椅“ 它们一直沉默着等候在那里，尽管四年悲喜已不在我手里。而我曾在它们等待的姿态里，在清晨浓烈的青草气息里，在午后石板交叠的光影里，在黄昏时渐渐吞没它们和我的暮色里，铭记那时匆匆消失在我生命里的一人一事，忘却彼时扰乱我心绪的一乐一叹，学会无怨无悔地奔跑，亦学会爱和遗忘。我也会很想念你们，所以我把最好的自己和故事都留给你们。”我也会想念你·洗鞋店“ 老板总是在很认真地修鞋洗鞋，门口常常晾晒着一双双洗净的鞋子，白鞋居多。我称他为“为走的漂亮工作的人”。店铺里还挂着“天道酬勤”的字画，与老板的辛勤工作遥相呼应。”我也会很想念你·阳光地带斜坡“ 我有无数次路过你了吧，两段斜坡加一个拐弯，我就走够了四年。有时抱着沉重的快递包裹，有时只是背着书包；有时去买些新鲜水果，有时只去看看文具。可今天我路过，已是离别时节。就让我最后一次走过，把这里混杂着微尘与阳光的味道藏进记忆。”我也会很想念你·东区开水房“ 或许是刚进人大去的最多的地方，后来也很少去了吧。冬天的时候有一群人在这里，我也是其中之一。总会有一两个人在这里放下自己的一卡通。滚烫的热水，会让我想起你。”我也会很想你·鲜花店“ 毕业前，再买束鲜花吧，送给良师、送给益友、送给心里的ta。老板总是细致耐心地扎好每一束花，送出一捧芳香。多肉装点了四年的寝室，是DDL中的生命力，是生活的美感。”我也会很想念你·明新0407“ 总有些东西会让你记一辈子那么长，比如明德新闻楼那间熟悉的教室，那是牵绊着无数人大新闻人的情结。因为，在这里梦想初发芽，在这里我们初成长，眼神明亮，锐不可当。我也会很想念你，明新0407。”我也会很想念你·图书馆靠窗的桌椅“ 期末季，考试周，窗边的风景总能给些繁忙中稍许安慰。”我也会很想念你·紫藤园“ 东风6楼、东风7楼之间的园子。男生和女生之间隔着的神秘的紫色。”我也会很想念你·明新六楼讨论室“ 言语碰撞，观点交锋，清晨到黄昏，这里从不空闲。字字句句言辞或温和或犀利，朦胧间升腾起来的是人大新闻学子敢于质疑，勇于发声的精神与灵魂。我也会很想念你，因为昨天今天的你，明天的我总带着人大新闻人的印记。”我也会很想念你·运动场场边长椅“ 和它见面最多的是体测时候。女生们的包，男生的水杯都放在上面，旁边是挥洒汗水的地方。每次成绩不太如意，都要发一个约夜跑的朋友圈。”这是在人大的点点滴滴。你，会想起他们吗？图文：杨天慧 王思未 张绪延 李宇轩 赵珉庆美编：新媒体中心 刘静娴
2018-06-16,新闻一家人,http://mp.weixin.qq.com/s?__biz=MzA3MTA4MTAzMQ==&amp;mid=2657477687&amp;idx=2&amp;sn=d0f12aa3bf2bbeea221069fd7520f7b0&amp;chksm=84a2491fb3d5c00936193e5587ecc2128f7ee758f8a28fe9fe0dd7a071422a4a54790ed2ea81&amp;scene=27#wechat_redirect,毕业季 | 毕业班风采展示——2014级本科国防班,"相逢又告别,归帆又离岸，毕业是一次分别，也是未来旅途的开始。在接下来的一系列推送中，让我们一起听听毕业班的老师同学们的感想吧~班级风采简介青春一抹橄榄绿，同窗四载兄弟情！2014级国防班这个大集体汇聚了来自五湖四海的32名小伙子。四年来，他们一起在田径场挥洒汗水，一起在东门升旗台迎接日出，一起在部队摸爬滚打……毕业在即，同学们即将各奔东西，奔赴祖国各条战线，愿大家不忘曾携手并肩走过的青春岁月，将人大红与橄榄绿永远铭刻在记忆里！班主任寄语人大红与橄榄绿，赋予了2014级新闻国防班32个大男孩别样的大学时光；同窗谊与战友情，诠释了青春与使命的意义。四年前你们满怀期冀而来，四年后你们满载知识和阅历踏上新征程。志合者，不以山海为远。离别虽感伤，未来亦可期。无论何时，愿你们拥有乐观豁达的心态，百折不挠的勇气，用脚踏实地的行动书写健康美好的人生。——孙浩爽老师毕业感言似水流年，过去的真快；在人大的四年，是我人生中最美好的岁月，夜坐听风，昼眠听雨，俯仰间全叫人能触到灵性。我们青年骨子里是永远趋向于闯荡的，永远如初读的航海者，想隔断系岸的缆绳，扯着风帆，欣欣地踏上新征程，启航新梦想；但在恣意遨游时，勿忘书是理想的伴侣。——2014级国防班胡磊""我们今天是桃李芬芳，明天是社会的栋梁。""无论是继续深造，还是走上工作岗位，祝福同学们都能完成自己的梦想。图文来自2014级国防班美编：新媒体中心"
2018-06-15,新闻一家人,http://mp.weixin.qq.com/s?__biz=MzA3MTA4MTAzMQ==&amp;mid=2657477682&amp;idx=1&amp;sn=b6dbc84b592930034c1a91bd5d060e7a&amp;chksm=84a2491ab3d5c00ce8a3f955383ca19f8bf198af93d49752ee59c1b68daa3afb3b8902ff78f6&amp;scene=27#wechat_redirect,毕业季 | 灯光再起，毕业如期,灯光再起，毕业如期又是一年茵茵六月，又是一次毕业与离别，行走的是年月，不变的是你我的笑脸。在人大的这几年，我们从陌生变得熟悉，从害羞变得勇敢。还记得那年一二九的舞台，记得五四文艺汇演的舞台，记得跨年晚会的舞台……如今，舞台灯光再起，毕业晚会即将拉开大幕在这个舞台上书写的是青春，是我们共同走过的时光。在这个舞台上歌唱的是最真挚的感情，是我们对彼此的每一点回忆。在这个舞台上畅想的是明天，是我们更加璀璨耀眼的未来。经过了几年的朝夕相处，一切的一切对我们而言都是再熟悉不过的了。但是看到自己的同窗又一次拿出自己的才艺，看到亲切的老师们再一次讲着对同学们的殷殷期待，看到那年一起走进人大，走入新闻学院的你我还是那样笑着。我们的心中总是会流出一种熟悉却也新鲜的感动。来吧，再一次欢聚，不说告别，只敬青春。欢迎各位“未毕业生”们叫上同窗同学，同寝伙伴，或是自己的那个ta，积极报名参与才艺演出！有兴趣表演节目的同学请扫码进群！6月28日晚，毕业晚会，我们不见不散！图文：文化部美编：新媒体中心 李宇轩
2018-06-15,新闻一家人,http://mp.weixin.qq.com/s?__biz=MzA3MTA4MTAzMQ==&amp;mid=2657477682&amp;idx=2&amp;sn=c40a904b77471b773c63759083192de2&amp;chksm=84a2491ab3d5c00c639efc8c64ff9b148e0a37ddabea10c8c85ec13e193abf9411784970671b&amp;scene=27#wechat_redirect,毕业季 | 毕业班风采展示——2014级新法班,"相逢又告别,归帆又离岸，毕业是一次分别，也是未来旅途的开始。在接下来的一系列推送中，让我们一起听听毕业班的老师同学们的感想吧~班级风采简介2014级新闻法学实验班，是一个14人组成的大家庭，是一个男女比例1：7的团体，是一个兼修新闻学法学的班级，是上榜的“中国人民大学优秀班集体”……来自各地的我们，入学之初选择了这个特色实验班，尽管要多学一个专业的课程，刷夜背书成为常态，奔走繁忙成为日常，但每个人都在这个集体环境中一步一步坚持和成长，在新闻里寻找真实，在法学里凝望正义，沿着自己选择的道路，在人大实现自己的理想。班主任寄语亲爱的2014新法班的同学们，时间飞逝，马上就要送你们毕业啦，真是舍不得，四年来一直陪伴着你们，似乎还有好多话想和你们说，但又顿住了，似乎你们已经长大……在四年的奋斗中，大家收获了知识、友谊和成长，取得了让母校骄傲的成绩，但这仍然只是人生的又一个新的开始，期望在今后的生活中，大家能继续健康、快乐地去生活，勇敢地去追逐自己的梦想。——2014级新法班班主任  赵云泽老师毕业感言前两天刷到一条微博：“你们读大学开心吗？”我在转发里写的是：“太开心了，真的！可能是我最开心的四年！”本科生活极大地改变和塑造了我：在新法班里两个学科相互凝视互相反思的学习体验，在辩论队里从打开思路到收敛体系的备赛过程，在无数优秀的同龄人身边看见、感知、进入新世界的成长变化，甚至是在东风破的宿舍楼里酸中有甜的集体生活，都是太美妙的回忆了。要怎样形容我的大学生活呢？“'你最可爱'，我说时来不及思索，而思索之后，还是这样说。”——2014级新法班 慕海昕夏日夜晚草坪边的歌声，清晨骑车从东边去明德上课时耳边吹过的风，图书馆里悦耳的安静……四年恍然过去，人大还是我们初到时那小巧精致的模样，好像从来都没有变过，但我们都已从懵懂变得成熟，有了人大深深的烙印。在新闻楼里熬夜编辑过的稿件，在求是楼里通宵背过的法律，在图书馆里最爱的座位；还有每一任老师的言传身教，新法班每位勤奋优秀的同学，温馨的东六514里可爱的室友……人大真的非常可爱而特别，也感激自己寸阴珍惜。四年前感激遇见，期待来日重逢。——2014级新法班 热依扎·马尔哈巴时光如水般流淌，转眼间我与新闻学院四年的故事就写到了尾声。在这里我与良师挚友相遇，他们叮嘱“别拖延，别放弃”，他们严格要求要我保持客观公正，他们鼓励我勇敢前行。在这里我度过了价值观塑造与形成的重要时期，学到了可以受用一生的知识和道理。愿亲爱的你永远熠熠生辉，愿我有朝一日也成为你的一道光。谢谢你，新闻学院！——2014级新法班 吴竞""我们今天是桃李芬芳，明天是社会的栋梁。""无论是继续深造，还是走上工作岗位，祝福同学们都能完成自己的梦想。图文来自2014级新法班美编：新媒体中心 陈昱希"
2018-06-14,新闻一家人,http://mp.weixin.qq.com/s?__biz=MzA3MTA4MTAzMQ==&amp;mid=2657477678&amp;idx=1&amp;sn=c62961014ace937997f728cc0b4f96fd&amp;chksm=84a24906b3d5c0108ccb1cc449d11a0c9a3f1a7c255546b563a0f9876de62958203c9f82f9e0&amp;scene=27#wechat_redirect,毕业季 | 最夺目的一刻，让红毯替你记得,最夺目的一刻，让红毯替你记得初入校时，总感觉四年遥遥无期转眼之间，已到了各奔东西的时刻可能这四年间留下的遗憾很多或许是没能好好认识的人或许是没能认真说出的话或许是没有尽力完成的事既然往昔已去，无法更改那就在毕业前尽力做好一件事情吧：以最美好的姿态和最真诚的态度在红毯上和四年光阴好好告别除了有红毯、镜头与掌声红毯秀还准备了精致的蛋糕并将邀请每一位毕业生一起为学院留下独一无二的纪念品希望能够用香甜的口感冲淡离别的苦涩用按下的手印纪念青春的时光每一种独一无二的风采都应该被记录每一份绝无仅有的感情都应该被喝彩无论是哪一种夺目的装扮无论你的身边是老师、挚友、父母亦或伴侣我们都准备好了镜头与掌声暂定6月28日下午的红毯秀我们期待特别的故事与特别的你！请点击阅读原文报名毕业红毯秀图文 文化部美编 新媒体中心 陈昱希
2018-06-14,新闻一家人,http://mp.weixin.qq.com/s?__biz=MzA3MTA4MTAzMQ==&amp;mid=2657477678&amp;idx=2&amp;sn=3edc6870f8521544acead17d4c5898b5&amp;chksm=84a24906b3d5c010083fed344d41cfa0b4a2bb7393ad3dc948353c1497b506d1c205400a8fe8&amp;scene=27#wechat_redirect,毕业季 | “衣短情长”毕业捐衣活动,“衣短情长”毕业捐衣活动一、活动简介 临近毕业收拾自己的行李你有没有发现有些衣服带不走你有没有想过把它们留给需要的人在这个繁华的城市有许许多多的人我们不知道他们的姓名但他们无处不在默默地做着最不起眼的工作衣短情却长毕业捐衣活动让你的衣服温暖他人此次活动面向全院毕业生，鼓励同学们将多余衣物送到统一的捐衣点。捐赠的衣服将由我们打包好送往北京市工友之家同心互惠公益项目，由他们分拣整理后送给需要衣物的打工者。二．活动细则主办单位新闻学院学生会志愿团承办单位北京市工友之家同心互惠活动时间6月17日~6月19日14：00-17：00活动地点东风宿舍区（6月17日下午）知行宿舍区（6月18日下午）明德新闻楼二楼彩虹小屋（6月19日下午）在活动时间内，你可以到东风宿舍区、知行宿舍区或明德新闻楼二楼彩虹小屋捐赠衣物，我们将安排专人负责回收。此次活动回收的衣物不限大小种类，但要求干净。活动之后，你可以获得0.5小时的志愿时数。图文 志愿团美编 新媒体中心 陈昱希
