datetime,source,url,title,content
2018-12-18,新闻一家人,http://mp.weixin.qq.com/s?__biz=MzA3MTA4MTAzMQ==&amp;mid=2657478426&amp;idx=1&amp;sn=02f91ca1ee7ea24ac66cef37de799afe&amp;chksm=84a24a32b3d5c324d77a7045b089117b9f64792d0cab6cc99a64671de8e246b94130141c7d3a&amp;scene=27#wechat_redirect,硕果累累，矢志创“新” | 2018年新闻学院学生会工作总结,岁月迎来送往，时光如水前行。欢笑与泪水、遗憾与满足、幸福与哀伤共同交织成了平凡却不平淡的2018年。这一年里，新闻学院学生会致力于全方位满足同学们的需求，为新闻学子提供了丰富的文体、学术、志愿服务资源。在学校各类大型活动中也不乏优秀新闻学子的风采，“新闻一家人，我们爱你们”的口号也越来越响亮。文体活动文化活动1、“五·四”文化艺术节在第二十四届“五·四”文化艺术节中，无数新闻学子展现出了新闻人的风采。新闻学院荣获音乐素质比赛器乐一等奖、声乐三等奖、舞蹈比赛非群舞二等奖、非群舞三等奖、诗歌朗诵比赛群诵三等奖、独诵二等奖、主持人比赛三等奖、小品曲艺比赛小品二等奖，曲艺三等奖，团体总分第五名的成绩。2、毕业季系列活动2018年毕业季，学术部邀请高钢教授为毕业生讲授最后一课，对活动的形式进行了创新，设计了模拟小测、课堂提问等新颖的活动形式，同时，举办了毕业红毯、毕业晚会等活动，给毕业生留下了美好的回忆。3、“一二·九”青春歌会新闻学院十三名同学用阿卡贝拉的形式演唱的《奉献》，声声动情，声声入心，在本届“时代新声”团支部“一二·九”青春歌会中荣获“最佳歌唱奖”。4、“一二·九”合唱音乐节系列活动“一二·九”合唱比赛是“一二·九”系列活动中重要的一个组成部分。经过两个月的辛苦排练，新闻学院117位合唱团成员以《陕北公学校歌》和《天耀中华》荣获中国人民大学第三十二届“一二·九”合唱比赛A组三等奖。体育赛事1、排甲在排球甲级联赛中，新闻男排女排表现出色，以优异的成绩成功保甲。2、全校运动会在中国人民大学第59届全校运动会中，新闻学院荣获男女团体总分第五名、女子团体总成绩第五、男子团体总成绩第七的好成绩。3、篮甲在中国人民大学篮球甲级联赛中，新闻男篮女篮勇夺冠军，收获双冠。4、足甲新闻学院在足球甲级联赛中，挺进四强，勇夺季军。5、羽毛球联赛新闻学院积极参与第16届“白羽惜别”羽毛球团体赛，运动员们努力拼搏、配合默契，收获了运动的快乐和团队的友谊。6、乒乓球联赛新闻学院积极参与“全校乒乓球联赛”，新闻学子于赛场上努力奋斗，收获颇丰。7、毕业生篮球告别赛新闻学院于6月10日举办了“毕业生篮球告别赛”。新老生共同打出一场充满纪念意义的比赛，收获了珍贵的回忆。8、新生篮球赛新闻学院于9月16日举办了“新生篮球赛”活动。2018级新生与新闻男篮前辈们在篮球场展开了一场实力的较量。9、全校篮球赛新闻学院于9月-10月积极参加全校篮球联赛活动。新闻学院男篮、女篮实力强劲，均取得了四连胜的好成绩。10、新生运动会在中国人民大学第七届体育文化节暨2018级新生田径运动会中，新闻学院获得团体总成绩第三名、男子团体总分第三名和女子团体总分第五名的好成绩，并以良好的观赛秩序荣获体育道德风尚奖。11、羽毛球联赛在第四届羽毛球联赛中，新闻学院选手积极应战，在女双比赛中晋级下一轮。12、“一二·九”长跑活动新闻学院在12月的“一二九”校园越野赛中，获得个人第一名和第二名、男子团体第三名、男女总团第六名的好成绩。13、健美操比赛12月12日，新闻学院代表队以一曲《Hidden Dragon》亮相如论舞台，最终荣获第十九届健美操大赛二等奖。志愿服务1、“音画梦想”支教活动春季学期和秋季学期，新闻学院志愿团和音画梦想组织合作，开展了八次支教活动，帮助留守儿童们学习艺术课程。2、香山喂猫春季学期，新闻学院志愿团每周周六周日各招募两位志愿者，和香山TNR猫友项目的志愿者们一起到香山喂养流浪猫。3、毕业季活动毕业季，志愿团和生活部一起组织了毕业捐书、毕业捐衣活动。4、走进喵星人新闻学院志愿团在10月-12月开展了走进猫星人活动，招募志愿者到北京动物园社区打扫卫生和照顾猫咪，组织活动九次，累计参加人数达四十人。5、献血活动11月18日，新闻学院志愿团和校青协合作，带领13位志愿者成功参与“生命之光”无偿献血暨“生命之翼”造血干细胞血样采集活动。6、社区志愿活动新闻学院志愿团和马连洼街道对接，在四个社区招募志愿者，不定期地开展团员志愿活动。生活1、女生节3月7日，新闻学院学生会生活部组织新闻学院男生向女生们送上鲜花和明信片。2、宿舍督察过去一年，新闻学院学生会生活部与校学生会权益生活部、校自管会等职能相近的上级部门积极联系，配合相关工作的开展，承接了2017“拾光为家，齐奏华章”新生宿舍形象设计大赛、“2018，宿舍我家”宿舍美化大赛、2018“寓见拾光”新生宿舍形象设计大赛、校级十佳宿舍和优秀宿舍评选等赛事在新闻学院范围内的组织、宣传、推荐工作，知行二楼509、品园六楼430、知行五楼706、品园六楼431、品园六楼423等优秀新闻学子宿舍脱颖而出。学术资源1、明新读书会明新读书会作为新闻学院的明星项目，每月举办1-2次。本学年先后邀请新闻学院的王亦高老师、王润泽老师、塔娜老师、赵小曼老师为同学们推荐书籍并进行深入浅出的讲解，帮助同学们开阔视野，增长知识。2、校友讲坛“校友讲坛”定期邀请新闻界校友重返母校，与在校生分享实践经验。通过“校友讲坛”这个平台，建立起教育与实践一线的桥梁，帮助同学们立足理论，开拓视野，将人大新闻人的精神和传统薪火相传。截至2018年7月底，校友讲坛已成功举办17期。3、传媒零距离传媒零距离系列讲座邀请校内外知名学者、媒体人走进新闻学院，带来传媒行业的最新动态，帮助同学们提升专业素质，深化对新闻工作的理解。同时，也为校内对新闻行业有所兴趣的同学提供一个学习和交流的平台。4、新老生经验交流会为了帮助刚入学的大一新生尽快适应大学生活，学生会组织举办了新老生交流会活动，分别邀请郑可书、姚京宏、吕金蔚、毛佳文等历届优秀学子分享关于学习、学生工作和生活上的经验与体悟。5、辩论赛5月，新闻学院辩论队问鼎第十三届二十院院际友谊辩论赛总决赛。11月，辩论队在中国人民大学第26届辩论赛中止步八强，但队员们表现优异，赛出了新闻学子的风采。作别2018，和过去挥手再见，把美好长留心中。拥抱2019，对明天心怀期待，向未来砥砺奋进。新闻一家人愿永远伴你左右，与你分享快乐，分担痛苦，给你慰藉，与你携手同行。新闻一家人，我们爱你们。整合：新闻学院学生会美编：新媒体中心 陆佳楠
2018-12-17,新闻一家人,http://mp.weixin.qq.com/s?__biz=MzA3MTA4MTAzMQ==&amp;mid=2657478419&amp;idx=1&amp;sn=1416f2675af7b152cb9d280fd388bb0c&amp;chksm=84a24a3bb3d5c32d6178734a35944996fa583f9625e10a71046e0c07406c037f81cd3b8b9c2b&amp;scene=27#wechat_redirect,第五届“好记者讲好故事”巡讲活动在中国人民大学举行,12月14日，由中宣部和中国记协共同组织的第五届“好记者讲好故事”巡讲活动在中国人民大学国学馆举行。来自全国新闻媒体的10位记者与新闻学院师生讲述了职业生涯中感人的故事和深刻的体会。巡讲活动由中国人民大学新闻学院党委书记兼副院长周勇主持，中央广播电视总台周益帆、黑龙江日报报业集团董新英、中国青年报社章正、辽宁省沈阳日报社贾咏、天津津云新媒体集团闫征、江西萍乡市广播电视台任星燃、宁夏回族自治区银川市新闻传媒集团李博豪、青海广播电视台青海卫视管楠、贵州日报社桂林爱、光明日报社郑晋鸣分别做了主题演讲。从《感受生长》中的三个关于小朋友的故事，到《用脚步丈量脱贫路》《在这，我们守望正义》《不送你》《带不走的幸福路》《与老阿姨的三次握手》《新时代的黄河保卫战》《破风者》《听，让光从心里长出来》《手捧滚烫故事，传递楷模精神》，每一个鲜活的故事，每一次真诚的讲述，都给在场师生留下了深刻的印象，引人思考。周勇教授在总结中说，通过新闻工作者在一线采访报道中看到或经历的故事，我们一方面能从中发现采访报道的技能和方法及其在实践中的应用，更重要的是受到一种情感和价值观层面的陶冶。无论做什么工作，做一个正直的、有责任感、认识社会、了解国情理解他人的人，都是一个值得我们去追求的目标。巡讲会后，新闻学院师生就新闻专业学习研究和职业发展的问题与宣讲团成员展开交流座谈。新闻学院2018级硕士研究生朱格侨悉提问如何找到好的选题。郑晋鸣回答说，要注重练就善于突破迷雾、找到真相的基本功，发现社会正能量，没有诀窍和捷径，真正鲜活的素材就在泥土里。2018级硕士生姜思宇问道，公民新闻时代的记者应该更注重效率还是需要时间辨清事实。周益帆回答，当每个人都拥有权力和渠道来承担媒体责任时，他们传播的内容是否正确需要思考。社会需要专业和理性的声音，尤其是新闻媒体，最终传播的内容是需要给人带来思考的，在这种情况下，专业媒体的守望更为重要，更应该坚守媒体的职能和伦理。新闻学院2016级本科生刘翱源提问如何能够在采访中挖掘出打动人心的故事并呈现出来。任星燃结合自己在基层工作的经验回答，要“走进去”挖掘故事，“走出来”呈现故事，并且坚信任何一片土地都有自己的魅力。新闻学院党委副书记蒙彬、副教授唐铮参加座谈，100余名师生现场聆听巡讲。图/许文心 彭美琪文/王梦丹 赵珉庆 廉欣培 许文心
2018-12-16,新闻一家人,http://mp.weixin.qq.com/s?__biz=MzA3MTA4MTAzMQ==&amp;mid=2657478415&amp;idx=1&amp;sn=941e8fe7056eef512aa91f85c0f569b5&amp;chksm=84a24a27b3d5c331d53b7756fac1f6842bc2583eb6ff8ecdcb0c973e7b6edc4e157750dea035&amp;scene=27#wechat_redirect,爱生活 | 冬天也要暖暖鸭——冬季保暖特辑,冬季保暖特辑人大的冬已经撒了欢儿地跑来。来自南方的同学们恨不得马上飞回秦淮一线以南享受零上摄氏度的冬天，而对于北方的同学，无论是来自东北的“纯爷们”，还是来自内蒙“套马的汉子”，在北京的寒风中也是帅不过三秒的。因此，为了让大家在冬天不要每天思索如何出逃海南避寒，而是安安稳稳没有后顾之忧地留在人大努力学习，小编特此为大家带来冬季保暖特辑！今日份的爱生活也是一样爱大家呢！「比心！」一、出门篇御寒不能只靠坚强的意志、不服输的精神以及打死都不说冷的决心！还要有这些好盆友！好盆友1：棉袄菌和羽绒服亲棉袄菌和羽绒服亲有什么区别呢？顾名思义，一个里面是毛，一个里面是羽绒啦。羽绒服虽然比棉袄暖和，但缺点是太厚，显得人很臃肿。棉衣虽然轻薄，但保暖效果比较差。有时候现实就是辣么残酷，你不得不穿上厚重的羽绒服，像一个穿着铠甲去公教一二三楼打仗的大兵……好盆友2：配件小伙伴手套围巾带着他们的小伙伴们也及时赶到了战场！冬天要出门，从上暖到下！废话不多说，和我说一遍！「围巾围起来！手套戴一对！护耳卡上去！护腰护膝不忘记！」围巾一条长围巾围在脖子上不仅能展现静态的典雅，还能体现动态的流水般的温柔，围巾的系法也是千变万化，由于内容太多，示范难度大，本期推送就不一一呈现啦。「此时新媒体突然意识到了什么」「生活部：」暖腰宝你听说过暖宝宝，听说过护腰，可你听说过暖腰宝吗？这款神器融合了两者精髓，不仅把各位姐妹的腰暖暖地包围，其中可以插入热水袋的设计更是让保暖效果上了不止一个台阶！配合羽绒服一起使用效果更好！我们的宗旨：既然已经显得臃肿了，那为什么不再让自己暖和一点～除此之外，还有耳罩、棉靴等各种各样的出门必备单品！大家可以自行发掘哦～当然，如果大家坚持选择美丽冻人的话，我们还有终极秘方——二、宿舍篇“宿舍里真是太暖了，我都不想去公教了！”“图书馆里真是太暖了，我都不想回宿舍了！”同学们不禁感叹：暖气真的可以说是人类历史上最伟大的发明之一了！但是要想在冬天的宿舍里坚强的活下去，光靠暖气还是远远不够滴。看看下面的传说装备和史诗神器，赶紧动手氪起来吧！棉拖鞋棉拖鞋绵软护脚，穿着舒适，温馨可爱，近年来深得越来越多人们的喜爱～但是划重点！在宿舍不要选择有加热功能的棉拖鞋哦！宿管阿姨透露已有拖鞋烧糊现象，为了大家的安全，请坚决制止这种拖鞋！楼梯垫楼梯垫，在大学生宿舍中常用，在保护楼梯踏步的同时也能起到很好的防滑、保暖等作用。以后上下床的时候再也不怕冻jio了哈哈哈哈！棉被还有什么比棉被更让人心动的！每天最幸福的时期就是裹上被子的那一刻，感觉心都坐在棉花糖云朵里飞起来了呢～蔡健雅的《红色高跟鞋》这样唱道：“你像窝在被子里的舒服～”暖身神器既想在被窝的温暖中苟且，又认为自己好像应该做一个优秀大学生，怎么办？暖身神器你值得拥有！从脚到手的温暖体验，我想开了，你呢？这些产品组合后适用于学生写作业、看手机、玩电脑、打牌、聊天等肥宅生活。具有新颖和实用的特点。总之只要肯（ lan）想（duo），人类的脑洞真是可以突破天际的！妙啊，本期冬季保暖特辑到这里就要结束了，各位小可爱们学会如何暖暖地度过这个人大的冬天了吗？不聊啦，小编要去为新媒体部做下一篇推送咯！文案：生活部 高鹏飞 吕耀 张翊飞图源自网络美编：新媒体中心
2018-12-15,新闻一家人,http://mp.weixin.qq.com/s?__biz=MzA3MTA4MTAzMQ==&amp;mid=2657478410&amp;idx=1&amp;sn=35bf7e26f6be9eaec1028ccc3e09383e&amp;chksm=84a24a22b3d5c334e15fa976c25053b8d5466a6f9ccad3984ac1852b98f28feee72fdbaa21ff&amp;scene=27#wechat_redirect,一起来看看新闻学院健美操超燃的武侠现场表演吧！,健美操小分队的精彩表现仿佛还在眼前“新闻一家人，我们爱你们”的呐喊犹在耳边仍想回味精彩表现？还在惋惜没有抢到票或者有课无法前往？实践部为我们记录了健美操小分队在如论舞台的精彩表现一起来看看新闻学院健美操超燃的武侠现场表演吧！视频：实践部
2018-12-13,新闻一家人,http://mp.weixin.qq.com/s?__biz=MzA3MTA4MTAzMQ==&amp;mid=2657478405&amp;idx=1&amp;sn=9a100627a861492a3925586442d703a6&amp;chksm=84a24a2db3d5c33bb819dfdee39650734996b6c5a7892c5282f1d9ac6a312ae5776a8f0ae42d&amp;scene=27#wechat_redirect,新里有术 | PR添加特殊字幕,本期的新里有术将为大家带来用（不只是）Pr添加特殊效果字幕的方法。用两种软件让字幕在视频里尽情遨游，让两种声音为您倾情详细讲述。看不了吃亏，看不了上当，手把手包学包会。还等什么，海量Pr（biao）技（qing）能（bao）就在本期新里有术！视频：实践部文字：实践部美编：新媒体中心
2018-12-12,新闻一家人,http://mp.weixin.qq.com/s?__biz=MzA3MTA4MTAzMQ==&amp;mid=2657478400&amp;idx=1&amp;sn=f9e1ab2d130064fd68541d47855228ca&amp;chksm=84a24a28b3d5c33eb52419fd988c1d5082577282ee4f14377d211aca017ee740184d1d802f16&amp;scene=27#wechat_redirect,赛事速递 | 新闻学院健美操队获得第十九届健美操大赛二等奖,12月12日18:30，中国人民大学第十九届健美操大赛在明德堂拉开帷幕。经过两个月的紧张训练，新闻学院代表队以一曲《Hidden Dragon》亮相如论舞台，最终荣获二等奖。新闻学院代表队第十五位出场。本次比赛，新闻健美操队在编舞中融入传统色彩，健美操的动感与力量，中国风的韵味与特质交织，将武侠的英气与舞蹈的美感巧妙融合。光影之下，亮与暗，红与黑，不同的元素在舞台上碰撞，活力四射，侠气凛然。队员们默契的配合，精准的动作，自信的状态，点燃了整个舞台。 两个月的汗水和付出，成就了舞台上的光彩夺目你们，那些激动人心的瞬间，将成为每个人心中最精彩而难忘的回忆。图文：新闻中心美编：新媒体中心
2018-12-10,新闻一家人,http://mp.weixin.qq.com/s?__biz=MzA3MTA4MTAzMQ==&amp;mid=2657478394&amp;idx=1&amp;sn=a4ac7de574e16fb038e235d95bd403ed&amp;chksm=84a24bd2b3d5c2c478b4663bce148a8a462dcdbaf2f58dfa42a17da16635198db8fb22504b29&amp;scene=27#wechat_redirect,新闻学院2018年学生代表大会召开 新一届学生会委员会选举产生,"12月8日，中国人民大学 2018年学生代表大会在学生活动中心东厅召开，来自学院本科生、硕士研究生、博士研究生各年级的100名学生代表参加会议。大会审议并通过了《中国人民大学新闻学院学生会章程（修正案）》，选举产生了2018-2019学年学生会委员会。新闻学院党委书记兼副院长周勇出席大会并致辞，学院党委副书记蒙彬、原团委常务副书记李佳育、党务秘书苏怡、校学生会副主席谷雨佳出席会议。大会由2017-2018学年学生会主席毛佳文主持。上午9时许，大会正式开始。学院党委书记兼副院长周勇代表学院党委对大会召开表示祝贺，对学生会为同学成长、学院发展和学科建设所做出的贡献表示感谢，对学生工作在大学生自我服务、自我管理、自我教育、自我监督方面所具有的意义予以肯定，并对新一届学生会委员会提出了期望。希望广大同学把学生会建设成为聚合全院学生力量的平台，激发大家的热情，促进自身专业能力和文化素养的提升；希望学生会将自身建设成为联系学生与学院的纽带，积极反映同学们的诉求，传递同学们的心声，努力实现学院信息的有效沟通。三是要做好支柱,发挥骨干力量，“在有意义的时代里做一些有意义的事情”，共同推动新时期新闻传播学科建设。中国人民大学学生会副主席谷雨佳代表校学生会致辞，肯定了新闻学院学生会在团结新闻学子、服务广大师生，举办品牌活动、凝聚青年人才方面发挥的重要作用，希望新闻学院学生会能继续发挥自身优势，带领广大同学在“追梦”与“圆梦”的路上，释放青春激情、追逐青春理想。2017-2018学年学生会主席毛佳文作学生会委员会工作报告，全面总结了学生会过去一年在组织建设、文化建设以及服务于学院发展、学科建设等方面取得的成绩，分析了坚持“资源下沉、重心下移”思路开展学生工作取得的成效，反思了制度建设等方面存在的不足，提出了对新一届学生会的期望。2017-2018学年学生会副主席韩硕作学生会委员会财务报告，对学生会过去一年的各项预算和支出进行说明。从总体上看，学生会各部门、团体能够合理有效的使用活动经费，努力争取并用好来自各方的经费投入，全体成员秉承责任意识，真正将经费用到实处，并在各方监督下不断完善财务系统。随后，大会审议并表决通过了《中国人民大学新闻学院学生会章程（草案）》及《中国人民大学新闻学院2018年学生代表大会及2018-2019学年学生会委员会第一次全体会议选举办法（草案）》10时，大会选举工作正式开始。与会代表听取了代表资格审查报告，并审议通过了大会监票人名单。在总监票人李峰主持下，与会代表进行投票，最终差额选举产生由姜思宇、李晴等31名研究生、本科生组成的中国人民大学新闻学院2018-2019学年学生会委员会。 中国人民大学新闻学院2018-2019学年学生会委员会第一次全体会议当天召开，现场选举产生新闻学院2018-2019学年学生会主席团。 现将选举结果公告如下  学生会主席：姜思宇学生会常务副主席：李晴学生会副主席：任美霖 邹文昌 朱格侨悉文：杨茂坤图：杨茂坤 许文心美编：新媒体中心"
2018-12-10,新闻一家人,http://mp.weixin.qq.com/s?__biz=MzA3MTA4MTAzMQ==&amp;mid=2657478394&amp;idx=2&amp;sn=bed358b7a657725f2f0b3ad78d8c939d&amp;chksm=84a24bd2b3d5c2c4b1483502f1e1e20253ccd348818052cbab0ae0ea7b58843df62aad7dc8ee&amp;scene=27#wechat_redirect,图集 | 12月9日，记得可爱的你们,新闻学院的“一二•九”，在一句“声声不息”中正式落幕。明法教室将不再为新闻“一二•九”灯火通明，只剩下了教室埋头自习的人们。“晚上再也没有排练了……”微信里再也收不到每晚的排练提醒，只留下了一句句对彼此的感谢。这一晚，新闻学院的“一·二九”在朋友圈刷屏，新闻学子们诉说着难以忘怀的回忆和感动。随着“一二·九”合唱比赛的落幕，与歌声相伴的两个月的时光也悄然结束。但是“一二·九”带给我们的点滴回忆将一直鲜活在记忆里，永不褪色。在这个不用参加“一二·九”合唱的夜晚，让我们一起来回顾属于我们的“一二·九”时光。7:30化妆时间把你的小脸凑过来高端设备一览精致女孩的自我修养没来得及吃早饭的大家在等待化妆的空闲时间加餐等待化妆的时间与学习更配哦待你长发及腰我们一起去唱“一二·九”可好来自拍吧我美吗？ 12:00最后的排练老师对大家进行指导大家不断进行开声和排练指挥在休息时独自练习参加排练的老师们休息时间大家席地而坐临上场前再补补妆~拍照留下自己最美的样子男生们共同努力拍出了一个“很正经”合影真实的正经合影16:00准备进场前往明德堂候场走进如论讲堂学姐再嘱咐一句16:30登台我们投入期许，一同奋进的那些日子不仅仅是为了蓝色海洋惊艳如论的八分钟更是想每个人都在这里，记住可爱的自己记住可爱的对方收藏一段可爱的时光我们，记得每一个你们可爱的样子一开始，或许没人想过自己可以撑到最后但是四十八天的练习里有“人美歌甜”的郭老师有每天陪伴大家的文化部和艺术团有想要倒水却一直被“拒绝”的学生会值班同学有“化完我们就出道”的化妆团队有微信群里“复读机”们恶搞的排练通知有发不完笑不够的黑照和表情包这些，让新闻人坚持到了最后谢谢“一二•九”，你让我们真正成为温暖的一家人。2019年10月，记得转发第三十三届一二九动员会推送。新闻一家人，我们爱你们。图：新闻中心文：新闻中心 杨天慧 文化部 王嘉瑜 李家琦美编：新媒体中心 王婧雯
2018-12-10,新闻一家人,http://mp.weixin.qq.com/s?__biz=MzA3MTA4MTAzMQ==&amp;mid=2657478394&amp;idx=3&amp;sn=e4d77ee08f24d11d3c62bf98fc8d229a&amp;chksm=84a24bd2b3d5c2c4cbfdf6bad2e6f906f57f98604501b7ee8d1a0db020d8f5631443db725a36&amp;scene=27#wechat_redirect,一起来看健美操大赛开场预热视频！,没有留意反复练习过多少次同样的动作，也没有记录在排练中又汗湿了多少件衣服。遭遇的困难都是为了如论舞台上的一刻绽放蓄力。12月12日晚，我们一起为新闻学院健美操小分队加油吧！一起来看健美操大赛开场预热视频！视频：实践部
