datetime,source,url,title,content
2020-01-13,青年网,http://youth.ruc.edu.cn/xwsd/26361f67bcc5481389fffc634a718c7d.htm,中国人民大学成立新时代中国青年发展研究中心,1月11日下午，中国人民大学举行习近平总书记关于青年工作的重要思想研讨会暨新时代中国青年发展研究中心的揭牌仪式。中国人民大学党委书记靳诺，中国人民大学荣誉一级教授邬沧萍，全国政协委员、团中央维护青少年权益部部长王锋，团中央社会联络部副部长、一级巡视员李骥，中国青少年研究中心常务副主任、研究员、《中国青年研究》杂志主编刘俊彦，中国人民大学党委副书记郑水泉、副校长杜鹏等出席活动。相关领域知名专家学者，有关地方和兄弟高校团委主要负责人以及中心首批特约研究员代表等参加会议。中国人民大学习近平新时代中国特色社会主义思想研究院执行院长秦宣教授首先介绍了新时代中国青年发展研究中心的有关情况。他表示，作为中央批准的全国首批习近平新时代中国特色社会主义思想研究机构，人大习研院成立新时代中国青年发展研究中心，深入研究阐释习近平总书记关于青年工作的重要思想，是应有之义、应尽之责。研究院将大力支持中心工作，整合优势资源，推动学术成果向政策成果转变，系统推进青年发展研究迈上新台阶。国家《中长期青年发展规划》牵头单位、团中央维护青少年权益部部长王锋对中心的成立和研讨会的召开表示热烈祝贺。他表示，成立新时代中国青年发展研究中心，围绕青年发展事业出谋划策、资政建言令人期待。他指出，中心的发展要深刻认识新时代青年发展的战略地位，汇聚合力构建和完善中国青年发展政策体系，为推进我国青年发展的制度完善和治理现代化提供有力支持。中国人口学、老年学的开拓者、奠基人，中国人民大学荣誉一级教授邬沧萍教授在致辞中深情回忆了自己亲眼见证中国从站起来、富起来到强起来的伟大历程，鼓励青年一代要学历史、扬情怀、担责任、敢奋进，在这个大有可为的时代努力创造更加美好的未来。中国人民大学党委书记靳诺为“新时代中国青年发展研究中心”揭牌中国人民大学副校长杜鹏代表学校致辞。他指出，党的十九届四中全会将包括共青团在内的群团组织和群团工作纳入国家治理体系和治理能力现代化的进程统筹考虑，充分体现了我们党对青年发展制度完善和治理现代化的高度重视。中国人民大学在青年研究方面有着很好的基础，不仅拥有扎实的学科支撑，理论研究队伍和团学工作队伍在实践中也有着很好的融合。他对中心的发展方向提出了三点希望，一是深入学习领会习近平总书记关于青年工作的重要思想；二是准确把握新时代中国青年成长成才的特点和要求；三是充分发挥高校在新时代青年发展政策研究中的重要作用。中国人民大学党委副书记郑水泉代表学校为中心特约研究员代表颁授聘书主题论坛围绕从教育中来——新时代教育改革中的青年问题；到社会中去——新时代社会参与中的青年问题；在市场中发展——新时代就业创业中的青年问题；与世界对话——新时代国际合作中的青年问题等四个主题展开研讨。中国人民大学教育学院副院长李立国教授，中国青少年研究会副会长、对外经济贸易大学廉思教授，教育部创新创业教育指导委员会委员、北京万学教育集团董事长张锐，中国人民大学重阳金融研究院执行院长王文等先后做了主旨发言；团中央社会联络部副部长、一级巡视员李骥，中国青少年研究中心常务副主任、《中国青年研究》杂志主编刘俊彦，中国人民大学国际交流处处长、国际组织学院执行院长时延安，得到APP副总裁冯启娜等先后做点评和交流。论坛中，与会专家学者，相关区市、高校团委主要负责人，中心首批特约研究员等嘉宾积极参与、气氛热烈。活动由中国人民大学校党委学工部副部长、校团委负责人、新时代中国青年发展研究中心主任杨子强主持。据了解，此次中国人民大学习近平新时代中国特色社会主义思想研究院成立新时代中国青年发展研究中心，将立足我校在人文社会科学领域的优势学术资源，聚焦新时代教育改革、社会参与、就业创业、国际合作等领域的青年问题，通过全方位、多层次的政策研究，力争孵化国家级青年问题研究高端智库，为新时代青年发展凝聚智慧、贡献力量。
2019-12-10,青年网,http://youth.ruc.edu.cn/xwsd/fc4f9f34285b486d81b42d1d0045d9e9.htm,用歌声向祖国报到——中国人民大学第三十三届“一二·九”合唱音乐节圆满落幕,在全校上下深入开展“不忘初心、牢记使命”主题教育活动之际，中国人民大学第三十三届“一二·九”合唱音乐节决赛12月8日在明德堂举行，共有25个学院组成20支队伍参赛，参与师生逾2000人次。比赛立足“讲好一个故事，唱好一支歌曲，砥砺一种精神”，引导广大师生不忘红色初心、牢记青春使命、投身伟大时代。校党委书记靳诺，党委副书记、纪委书记吴付来，党委副书记郑水泉，副校长杜鹏，副校长朱信凯，党委副书记齐鹏飞出席活动并颁奖。比赛中，各参赛队伍为观众呈现了一场异彩纷呈的视听盛宴。《保卫黄河》、《在太行山上》、《沂蒙山歌》、《东方之珠》、《狮子山下》等经典老歌带领观众重温激情岁月。《不忘初心》、《追寻》、《羊角花开》等时代金曲，奏响了激昂奋进的时代凯歌。《瑶山夜歌》、《康定情歌》、《玉门关》、《我喜欢》等歌曲曲调悠扬，深情抒发了对美好生活的热爱和追求。《长江之歌》《我爱你中国》、《国家》、《红旗飘飘》等经典旋律，表达了对伟大祖国的热爱之情。本届“一二·九”合唱音乐节还首次采用舞台纱幕投影，每支队伍都精心制作一段讲述歌曲背后初心故事的主题视频，让歌声更有历史厚度与情感温度。在竞赛演唱结束后，全场师生共同回顾了不久前逝世的“人民教育家”卫兴华教授的光辉事迹，寄托了无限哀思。教工合唱团带来演唱了《爱我中华》。参加中华人民共和国成立70周年庆祝活动的阳光合唱团与星光合唱团共同演唱了《我们都是追梦人》、《同心共筑中国梦》。纪念抗战胜利70周年大阅兵千人合唱团总指挥、解放军文工团常任指挥李成，国庆70周年庆祝大会中担任合唱训练总指挥、首都师范大学音乐学院副院长李刚代表评委点评，充分肯定了参赛师生的精彩表现。财政金融学院代表队、劳动人事学院代表队、艺术学院代表队、数学学院代表队分别获得A、B、C组金奖。靳诺、吴付来、郑水泉、杜鹏、朱信凯、齐鹏飞教授为各演出队伍颁奖。“一二·九”合唱音乐节是中国人民大学历史最悠久、参与面最广范、最具影响力的校园文化品牌活动之一，是进行爱国主义、集体主义、革命传统和爱校荣校教育的重要平台。本届“一二·九”合唱音乐节首次采用初赛-决赛两轮赛制。此前，各支参赛队伍已通过在明德楼、校史馆、老校区等校内标志地点无伴奏演唱《陕北公学校歌》的形式进行了视频初赛。截止目前，网络点播量已突破“10W+”，激发了广大师生的爱国热情。
2019-12-02,青年网,http://youth.ruc.edu.cn/xwsd/4f6e103d03474abc9d30e48ba91ea1f4.htm,交响乐团“围炉乐画”专场音乐会奏响明德堂,11月30日晚，中国人民大学学生艺术团交响乐团“围炉乐画”专场音乐会在明德堂顺利举办。本场交响音乐会选取了观众耳熟能详的电影配乐、舞曲及民族风情组曲等共9首经典乐曲。乐团以精湛的演奏与倾情的演绎唤醒了观众的音乐味蕾，带给观众一场“声”临其境的视听盛宴。上半场以一曲庄重华丽的波兰舞曲《波洛涅兹》拉开帷幕，铿锵的旋律中，仿佛能看到波兰军队踏着威武的节奏于光辉中走来。紧接着一首欢快俏皮的《温莎巧妇》点燃了现场观众的热情，整个明德堂充满了热闹欢愉的氛围。而《悲惨世界选段》则是深深拨动了人们的心弦，芳汀那遥不可及的梦、艾潘妮的心事以及巴黎人民不屈不挠、顽强抗争的精神，在乐团管弦交响与声起声落间得到了完美的诠释。在观众还久久沉浸于悲壮的余音中时，一首极具炎黄风情的《小放牛》组曲将一幅明丽的田园画卷展开在观众眼前，活泼跃动的小提琴声部作为全曲的主旋律，在寒冷的冬日带来了缕缕春风。下半场的第一首乐曲是由乐团的打击乐声部带来的小节目《鼓皮的对话》，其极具创意的演奏立即抓住了观众的心，演奏者深得其趣，观看者乐在其中。随后，交响乐团“人民五重奏”成员带来了两首探戈舞曲：《自由探戈》和《一步之遥》。五名演奏者默契配合，深得观众的喜爱，现场时不时响起热烈的掌声。随后上演的《指环王主题曲》则唤醒了无数影迷的记忆，犹如史诗般震撼人心。最后，久石让的《风之谷》和《幽灵公主》余音绕梁，音符之间虽有悲伤流淌，但亦有希望的曙光。在返场表演中，交响乐团以复仇者联盟的主题曲点燃全场，将现场气氛推向了最高潮，观众们的掌声如雷鸣贯耳，为本次专场演出画上了圆满的句号。本场音乐会由中国武警军乐团谢聪担任指挥。中国人民大学学生艺术团交响乐团成立于1997年，现有成员一百余人，其中大部分为普招生。乐团曾五度参加北京市大学生艺术节器乐展演，均获得金奖。去年，交响乐团成功举办了“冬夜幻想”和“仲夏庆典”专场音乐会，获得一致好评。此外，交响乐团曾与美国密歇根青年管乐团、德国慕尼黑工业大学爱乐乐团等国外大学青年乐团联合演出，获得了社会各界的广泛关注和一致好评。在不断的发展中，乐团的队伍持续壮大，成员也更趋多样性，吸引了越来越多的在校留学生、校友、团友以及兄弟院校友团团员的加入，始终维持着一百余人的规模。在今后，人大交响乐团将继续坚定文化自信，扎根中华传统优秀音乐文化，并积极认真地学习世界各国优秀作品，为全校师生带来更多优秀精彩的音乐演出，推动校园高雅艺术文化的建设与发展，为建设中国特色社会主义文化强国贡献自己的力量。
2019-12-02,青年网,http://youth.ruc.edu.cn/xwsd/e21ab56b5fee48008e4d606c310f8e86.htm,学生艺术团京剧社“缘定京生”专场演出唱响人大,11月29日晚，中国人民大学学生艺术团京剧社“缘定京生”专场演出在八百人大教室成功举办。在本次“缘定京生”专场演出中，演员们坚定文化自信，扎根传统经典，以对自我高要求的态度，为观众献上了诸多优秀作品的经典桥段，并将轻松活泼与严肃紧张的气氛完美融合，充分展现出了国粹艺术的无限魅力。演出包括两出传统折子戏《游龙戏凤》《大登殿》和两段经典唱段《牡丹亭·惊梦》《霸王别姬》。《游龙戏凤》是一出诙谐幽默、轻松活泼的“对儿戏”。舞台上，微服私访的正德皇帝风流潇洒，卖酒丫头李凤姐天真可爱，人物性格迥乎不同，相映成趣。《牡丹亭·惊梦》与《霸王别姬》都是旦角行当的经典唱段，二者一静一动，一昆一京，体现了人大京剧社兼容并包、百花齐放的发展理念。作为压轴好戏登场的《大登殿》更是热闹非凡、高潮迭起。剧中人物众多，舞台调度复杂，需要所有演职人员的默契配合才能顺利完成。为了演好这一出大戏，京剧社同学们“全梁上坝”，台前幕后通力合作，将最好的表演呈现在观众面前，同时也为整场演出画上了一个圆满的句号。学生艺术团京剧社的演员们唱腔委婉动人，表演认真生动，凭借扎实的功底与精湛的演技在舞台上塑造出一个又一个饱满生动的人物形象。俗话说“台上一分钟，台下十年功”，从最开始的对词、响排与彩排，到今晚的正式演出，京剧社同学们不断打磨，精益求精，力求向观众交上一份满意的答卷。人大京剧社初创于2002年，社内成员均为校内爱好京剧艺术的学生。自创社以来，京剧社始终致力于国粹艺术的研习和传承，坚持每周的基本功训练和戏曲知识学习，在普及京剧知识、活跃校园文化，以及弘扬国粹艺术等方面做出了重要贡献。对人大京剧社的同学们来说，专场演出不仅是为了在舞台上能“过把瘾”，更是为了深刻体悟国粹艺术和中国传统文化，并将其传递给广大师生。人大京剧社将借此宝贵机会继续努力，砥砺前行，吸引更多学生投身到戏曲的学习和实践中来，以严谨求实的态度和轻松活泼的方式，为国粹艺术的传承与弘扬不懈努力。“缘定京生”是学生艺术团2019年秋季演出季的首场演出。在接下来的两天里，交响乐团“围炉乐画”专场音乐会与合唱团“海晏河清”专场音乐会将陆续在明德堂精彩上演，敬请期待。
2019-11-15,青年网,http://youth.ruc.edu.cn/xwsd/7644aea9bec84564b95a52a9eefbc1e4.htm,中国人民大学服务保障国庆活动宣讲团赴湖北开展宣讲交流活动,11月10日-12日，按照教育部统一部署，中国人民大学牵头组建的首都教育系统服务保障国庆70周年重大活动宣讲团走进湖北，开展宣讲交流活动。11月11日，湖北站宣讲会在湖北大学举行，宣讲团领队、中国人民大学副校长杜鹏，中共湖北省委教育工委专职副书记孔祥恩，湖北大学党委书记尚钢出席宣讲会。武汉大学、华中科技大学、湖北大学等10余所学校的近千名师生和新闻媒体代表参加宣讲会。湖北大学党委副书记侯勇主持宣讲会。杜鹏在讲话中表示，中国人民大学作为中国共产党亲手创办的第一所新型正规大学，建校以来始终与党和国家同呼吸、共命运，始终坚持“立学为民、治学报国”的办学宗旨，始终奋进在时代前列。在中华人民共和国成立70周年庆祝活动中，人民大学承担了群众游行、志愿服务、广场合唱、联欢合唱等多项工作任务，2000多名师生参与其中，历经三个多月艰苦训练，用“永不懈怠的精神状态和一往无前的奋斗姿态”，向世界展现新时代中国青年的风采。他希望这次宣讲活动能成为中国人民大学和湖北省教育系统交流交往、互学互鉴的重要契机，共同传播和弘扬国庆活动留下的宝贵精神财富，持续推动爱国主义教育走深走实，引导广大干部师生将爱国热情转化为追梦新征程、奋进新时代的实际行动。孔祥恩代表中共湖北省委教育工委、湖北省教育厅对中国人民大学宣讲团表示欢迎和感谢。他说，习近平总书记高度肯定新中国成立70周年庆祝活动取得的巨大成功，强调庆祝活动是人民群众爱国主义精神的集中展示，要抓住契机，加强对人民群众爱国主义的教育和引导。我们要深入贯彻落实习近平总书记重要指示批示精神和党中央要求，发扬青年学生通过参加国庆活动形成的正确认识和高昂士气，认真讲好新中国成立70周年庆祝活动思政大课，有效利用庆祝活动宝贵经验，深化拓展庆祝活动教育成果，不忘初心，牢记使命，自觉把思想和行动统一到党中央的要求上来，立志为祖国繁荣富强奉献青春，为全面建成小康社会、实现中华民族伟大复兴中国梦贡献更大力量。尚钢代表湖北大学对中国人民大学宣讲团一行表示热烈欢迎，他说，此次中国人大宣讲团以亲身经历讲述国庆盛典，将是又一次生动的爱国主义教育课，必将激励广大青年学生把爱国情、强国志、报国行融入到个人奋斗之中。他希望大家认真聆听、用心体会、用情实践，勇做时代的弄潮儿，在实现中国梦的征程中放飞青春梦想，书写人生华章。中国人民大学服务保障国庆活动宣讲团由校团委负责人、宣讲团团长杨子强等21人组成。宣讲会上，7名宣讲团成员分享了在参与群众游行、志愿服务、广场合唱、联欢合唱等工作中的经历和感受，深刻诠释“青春与祖国同行”的精神，为在场师生上了一堂鲜活的爱国主义教育课。广场合唱团学生代表李建蓬以“跳起来的合唱团”为题分享了千人合唱团为祖国而舞，为祖国而歌的豪情。“众志成城”方阵11支队支队长边策以“是你给我前进的力量”为题分享了三次参加国庆群众游行方阵的珍贵记忆。“众志成城”方阵8支队支队长张煦昀以“国庆记忆里的起承转合”为题分享了国庆游行中的点点滴滴，展现了贯穿在起承转合中始终不变的爱国初心。“众志成城”方阵学生代表杨明聪以“你好，‘众志成城’”为题分享了作为汶川地震的亲历者见证“众志成城”从口号变成实践的点滴细节。联欢活动合唱团学生代表李睿哲以“我是广场合唱的‘后进生’”为题分享了经过不懈努力从后勤保障部门走向天安门广场，用歌声向祖国和人民报到的成长历程。“众志成城”方阵艺术指导王勇以“向着同一个方向”为题分享了方阵动作从构思编排到一遍遍修改的故事。国庆志愿者代表赵天阳以“观礼台上护红旗”为题分享了同万千群众一起在观礼台上为祖国母亲庆生、守护心中的红旗的志愿服务经历。宣讲会后，宣讲团成员上台接受了现场提问，和在场师生展开深入互动和交流。11月12日，宣讲团还分赴武汉大学、华中科技大学和武汉工程大学，开展座谈会、特色党课、主题团日等多种形式活动，同湖北广大师生面对面交流。
2019-11-07,青年网,http://youth.ruc.edu.cn/xwsd/db6ff8bec0eb48ce9f7568282f998e13.htm,中国人民大学“不忘初心、牢记使命”主题教育特别活动暨服务保障新中国成立70周年庆祝活动表彰大会举行,11月6日下午，中国人民大学“不忘初心、牢记使命”主题教育特别活动暨服务保障新中国成立70周年庆祝活动表彰大会在明德堂举行。“不忘初心、牢记使命”主题教育中央第二指导组成员、中央纪委国家监委案件审理室二级巡视员于凤玲，中国人民大学党委书记靳诺，常务副校长王利明，副校长贺耀敏、吴晓球，党委副书记郑水泉，副校长朱信凯，党委副书记齐鹏飞出席，各机关部处、学院相关负责人，国庆工作师生代表，2019级新生团校学员与会，活动由学生代表杨明聪主持。靳诺代表学校向参与70周年国庆重大活动的全体师生、向做出突出贡献的各单位、全体工作人员和各有关方面表示敬意和感谢。她表示，在全校上下深入开展“不忘初心、牢记使命”主题教育，认真学习十九届四中全会精神之际，我们召开“不忘初心、牢记使命”主题教育特别活动暨服务保障新中国成立70周年庆祝活动表彰大会有着重要意义。中华人民共和国成立70周年庆祝活动是国之大典，充分展示了新中国成立70年来的辉煌成就，人民大学师生参与并圆满完成群众游行、志愿服务、广场合唱、联欢合唱等工作任务，展现了人大人的使命与担当，更展现了人民大学的“始终与党和国家同呼吸共命运”的优良传统和“始终奋进在时代前列”的精神风貌，为学校赢得了荣誉。靳诺指出，10月16日，中国人民大学服务保障中华人民共和国成立70周年庆祝活动的1000多名师生以书信的方式向习近平总书记报告了参与国庆活动的感受和思考，表达了永远跟党走，永远奋进在时代前列的决心。近日，学校接到中办工作人员电话回复：“老师们、同学们的来信收到了，请转达总书记对大家的问候。”这是人民大学80周年校庆，收到习近平总书记的贺信后，再次直接收到的来自总书记的亲切关怀。人大师生要牢记总书记的关怀与嘱托，结合正在进行的“不忘初心、牢记使命”主题教育，以总结和表彰国庆工作为契机，全面开展以“学起来”“唱起来”“讲起来”“做起来”为主要内容的“我和我的祖国”爱国主义教育活动，把“壮丽70”的珍贵记忆转化成广大师生建设双一流、奋进新时代的强大动力。靳诺代表学校提出了三点期望。一是认真学习贯彻习近平总书记国庆系列重要讲话精神，高举爱国旗帜。二是讲好人大师生参与服务保障国庆活动的感人故事，砥砺奋斗精神。三是全面总结学校参与服务保障国庆活动的成功做法和宝贵经验，推动三全育人。希望大家传承好、发扬好“一支队伍就像一个人，一个人就是一支队伍”的众志成城精神，凝心聚力、开拓创新，在中国共产党创办的第一所新型正规大学里，让党的旗帜永远高高飘扬。表彰会上，靳诺为“中国人民大学服务保障国庆70周年重大活动宣讲团”授旗。王利明为突出贡献集体颁奖授牌。吴晓球为先进集体代表授牌。郑水泉为突出贡献个人指挥部代表授颁奖。朱信凯为突出贡献个人带队教师代表颁奖。齐鹏飞为突出贡献个人学生骨干代表颁奖。贺耀敏为突出贡献个人后勤保卫代表颁奖。在分享环节，星光合唱团代表李建蓬以《跳起来的合唱团》为题，分享了联欢合唱排练动作“留白”带来挑战的同时，也坚定了成员们“为祖国而舞、为祖国而歌”的决心。阳光合唱团代表李睿哲以《我是广场合唱的“后进生”》为题。分享了从合唱团后勤保障成员“晋级”为正式演出成员的过程和感想。指挥部教师代表李洪满以《国庆的重量》为题，分享了国庆记忆中身体之重、责任之重和情感之重的相关故事。带队教师代表肖晶以《一切美好，不负等待》为题，分享了大家由“被吐槽”转变为“被理解”，最终成为“被享受”“被点燃”的等待过程。2018级学生代表王诗龙以《千禧一代的使命担当》为题，分享了一家三代四人的国庆记忆，当“00后”接过历史的接力棒，他们的爱国心同样赤诚。志愿者代表秦天以《红墙背后的故事》为题，分享了志愿者“以志立愿，甘为行者”的动人故事。最后，全体在场师生共同唱响《我和我的祖国》，在饱含深情的歌声中，此次主题教育特别活动暨表彰大会落下帷幕。
